10,11,us,Apple,11,Baking Bootcamp: Apple Pie Biscuits - Joy the Baker,"Sep 10, 2014 ... + Four Awesome Sets of Prizes! The idea is simple! • Make these Apple Pie 
Biscuits (they're sooo delicious!) and take a picture of your creation! • ...",joythebaker.com,https://joythebaker.com/2014/09/baking-bootcamp-apple-pie-biscuits/,2020-12-29 12:16:35.002646+00:00,10800000,1DFPR-vmYogJ,10,Holisticseo.digital,7b8760de16d1e86bc,0.54,"10,800,000",https://joythebaker.com/2014/09/baking-bootcamp-apple-pie-biscuits/,https://joythebaker.com/2014/09/baking-bootcamp-<b>apple</b>-pie-biscuits/,"Sep 10, 2014 <b>...</b> + Four Awesome Sets of Prizes! The idea is simple! • Make these <b>Apple</b> Pie <br>
Biscuits (they&#39;re sooo delicious!) and take a picture of your creation! •&nbsp;...",Baking Bootcamp: <b>Apple</b> Pie Biscuits - Joy the Baker,utf8,customsearch#result,utf8,"{'cse_thumbnail': [{'src': 'https://encrypted-tbn3.gstatic.com/images?q=tbn:ANd9GcS8DeXQO2lPGQb896TAc2Elc9LHKtPCWZ6Obm9Q6FzEdzfSg1AluUco2hY', 'width': '183', 'height': '276'}], 'recipe': [{'image_url': 'https://joythebaker.wpengine.com/wp-content/uploads/2012/10/apple-pie-biscuits.jpg', 'cooktime': 'PT0H0M', 'preptime': 'PT0H0M'}, {'image': 'https://joythebaker.wpengine.com/wp-content/uploads/2012/10/apple-pie-biscuits.jpg', 'recipeinstructions': 'Place a rack in the center of the oven and preheat oven to 425 degrees F. Line a baking sheet with parchment paper and set aside.', 'name': 'Baking Bootcamp: Apple Pie Biscuits', 'cooktime': 'PT0H0M', 'description': 'Join King Arthur Flour and Joy the Baker for a second baking challenge. Bake these delicious biscuits, post a picture to instagram with the #bakingbootcamp between September 10th - October...', 'ingredients': '1 Fuji apple, peeled, cored and sliced very thin', 'preptime': 'PT0H0M', 'recipeyield': '12 biscuits'}], 'hrecipe': [{'summary': 'Join King Arthur Flour and Joy the Baker for a second baking challenge. Bake these delicious biscuits, post a picture to instagram with the #bakingbootcamp between September 10th - October...', 'yield': '12 biscuits', 'fn': 'Baking Bootcamp: Apple Pie Biscuits', 'photo': 'https://joythebaker.wpengine.com/wp-content/uploads/2012/10/apple-pie-biscuits.jpg'}], 'metatags': [{'p:domain_verify': '75e65d8d642c0dd6f88c068431a384b5', 'og:image': 'https://joythebaker.com/wp-content/uploads/2012/10/apple-pie-biscuits.jpg', 'og:type': 'article', 'article:published_time': '2014-09-10T09:00:41+00:00', 'og:image:width': '531', 'og:site_name': 'Joy the Baker', 'og:title': 'Baking Bootcamp: Apple Pie Biscuits - Joy the Baker', 'og:image:height': '800', 'twitter:label1': 'Written by', 'twitter:label2': 'Est. reading time', 'og:description': 'Baking is all about sharing. Sharing recipes, sharing techniques, and most definitely sharing biscuits! It’s time for our second challenge in the\xa0Baking Bootcamp series with King Arthur Flour! \xa0You blew me away by baking the Triple Berry Braided Bread with me for our first challenge. \xa0Hundreds of you participated and made the most lovely loaves...Read More', 'article:publisher': 'https://www.facebook.com/joythebaker', 'twitter:data1': 'joythebaker', 'twitter:data2': '6 minutes', 'article:modified_time': '2014-10-12T19:44:24+00:00', 'viewport': 'width=device-width, initial-scale=1', 'og:locale': 'en_US', 'og:url': 'https://joythebaker.com/2014/09/baking-bootcamp-apple-pie-biscuits/'}], 'cse_image': [{'src': 'https://joythebaker.com/wp-content/uploads/2012/10/apple-pie-biscuits.jpg'}]}",off,0.535399,11,"[{'src': 'https://encrypted-tbn3.gstatic.com/images?q=tbn:ANd9GcS8DeXQO2lPGQb896TAc2Elc9LHKtPCWZ6Obm9Q6FzEdzfSg1AluUco2hY', 'width': '183', 'height': '276'}]",,,"[{'image_url': 'https://joythebaker.wpengine.com/wp-content/uploads/2012/10/apple-pie-biscuits.jpg', 'cooktime': 'PT0H0M', 'preptime': 'PT0H0M'}, {'image': 'https://joythebaker.wpengine.com/wp-content/uploads/2012/10/apple-pie-biscuits.jpg', 'recipeinstructions': 'Place a rack in the center of the oven and preheat oven to 425 degrees F. Line a baking sheet with parchment paper and set aside.', 'name': 'Baking Bootcamp: Apple Pie Biscuits', 'cooktime': 'PT0H0M', 'description': 'Join King Arthur Flour and Joy the Baker for a second baking challenge. Bake these delicious biscuits, post a picture to instagram with the #bakingbootcamp between September 10th - October...', 'ingredients': '1 Fuji apple, peeled, cored and sliced very thin', 'preptime': 'PT0H0M', 'recipeyield': '12 biscuits'}]","[{'summary': 'Join King Arthur Flour and Joy the Baker for a second baking challenge. Bake these delicious biscuits, post a picture to instagram with the #bakingbootcamp between September 10th - October...', 'yield': '12 biscuits', 'fn': 'Baking Bootcamp: Apple Pie Biscuits', 'photo': 'https://joythebaker.wpengine.com/wp-content/uploads/2012/10/apple-pie-biscuits.jpg'}]","[{'p:domain_verify': '75e65d8d642c0dd6f88c068431a384b5', 'og:image': 'https://joythebaker.com/wp-content/uploads/2012/10/apple-pie-biscuits.jpg', 'og:type': 'article', 'article:published_time': '2014-09-10T09:00:41+00:00', 'og:image:width': '531', 'og:site_name': 'Joy the Baker', 'og:title': 'Baking Bootcamp: Apple Pie Biscuits - Joy the Baker', 'og:image:height': '800', 'twitter:label1': 'Written by', 'twitter:label2': 'Est. reading time', 'og:description': 'Baking is all about sharing. Sharing recipes, sharing techniques, and most definitely sharing biscuits! It’s time for our second challenge in the\xa0Baking Bootcamp series with King Arthur Flour! \xa0You blew me away by baking the Triple Berry Braided Bread with me for our first challenge. \xa0Hundreds of you participated and made the most lovely loaves...Read More', 'article:publisher': 'https://www.facebook.com/joythebaker', 'twitter:data1': 'joythebaker', 'twitter:data2': '6 minutes', 'article:modified_time': '2014-10-12T19:44:24+00:00', 'viewport': 'width=device-width, initial-scale=1', 'og:locale': 'en_US', 'og:url': 'https://joythebaker.com/2014/09/baking-bootcamp-apple-pie-biscuits/'}]",,[{'src': 'https://joythebaker.com/wp-content/uploads/2012/10/apple-pie-biscuits.jpg'}],,,,,,,https://joythebaker.com/wp-content/uploads/2012/10/apple-pie-biscuits.jpg,article,,,Joy the Baker,"width=device-width, initial-scale=1",,Baking Bootcamp: Apple Pie Biscuits - Joy the Baker,https://joythebaker.com/2014/09/baking-bootcamp-apple-pie-biscuits/,,"Baking is all about sharing. Sharing recipes, sharing techniques, and most definitely sharing biscuits! It’s time for our second challenge in the Baking Bootcamp series with King Arthur Flour!  You blew me away by baking the Triple Berry Braided Bread with me for our first challenge.  Hundreds of you participated and made the most lovely loaves...Read More",,2014-09-10T09:00:41+00:00,531,,800,Written by,Est. reading time,,joythebaker,6 minutes,,2014-10-12T19:44:24+00:00,en_US,,,,75e65d8d642c0dd6f88c068431a384b5,,,,,https://www.facebook.com/joythebaker,,,,,,,,,,,,,,,,
11,11,us,Apple,12,Salted Caramel Apple Snickers Cake | Half Baked Harvest,"Oct 17, 2014 ... The cinnamon is delicious with the chocolate and the sweet flavors of the apples. 
Oh, and since this cake is full of applesauce that means it's ...",www.halfbakedharvest.com,https://www.halfbakedharvest.com/salted-caramel-apple-snickers-cake/,2020-12-29 12:16:35.002646+00:00,10800000,,10,Holisticseo.digital,7b8760de16d1e86bc,0.54,"10,800,000",https://www.halfbakedharvest.com/salted-caramel-apple-snickers-cake/,https://www.halfbakedharvest.com/salted-caramel-<b>apple</b>-snickers-cake/,"Oct 17, 2014 <b>...</b> The cinnamon is delicious with the chocolate and the sweet flavors of the <b>apples</b>. <br>
Oh, and since this cake is full of applesauce that means it&#39;s&nbsp;...",Salted Caramel <b>Apple</b> Snickers Cake | Half Baked Harvest,utf8,customsearch#result,utf8,"{'hcard': [{'url_text': 'Suné Moolman', 'fn': 'Suné Moolman', 'photo': 'https://secure.gravatar.com/avatar/55673da631a79d6b7b6adb138ade0bf6?s=60&d=mm&r=pg', 'url': 'http://gravatar.com/addsomebutter'}, {'url_text': 'halfbakedharvest', 'fn': 'halfbakedharvest', 'nickname': 'halfbakedharvest', 'photo': 'https://secure.gravatar.com/avatar/49ee4a23a1d5dffb1944da32800bb254?s=60&d=mm&r=pg', 'url': 'https://www.halfbakedharvest.com/'}, {'url_text': 'Siunna', 'fn': 'Siunna', 'nickname': 'Siunna', 'photo': 'https://secure.gravatar.com/avatar/4f95f250fe136bba0fb5db50a458eecc?s=60&d=mm&r=pg', 'url': 'http://www.siunna.com/'}, {'url_text': 'halfbakedharvest', 'fn': 'halfbakedharvest', 'nickname': 'halfbakedharvest', 'photo': 'https://secure.gravatar.com/avatar/49ee4a23a1d5dffb1944da32800bb254?s=60&d=mm&r=pg', 'url': 'https://www.halfbakedharvest.com/'}, {'fn': 'tracy', 'nickname': 'tracy', 'photo': 'https://secure.gravatar.com/avatar/437ab4349bab99a0c3703faf8b43e6b5?s=60&d=mm&r=pg'}, {'url_text': 'halfbakedharvest', 'fn': 'halfbakedharvest', 'nickname': 'halfbakedharvest', 'photo': 'https://secure.gravatar.com/avatar/49ee4a23a1d5dffb1944da32800bb254?s=60&d=mm&r=pg', 'url': 'https://www.halfbakedharvest.com/'}, {'url_text': 'shweta a', 'fn': 'shweta a', 'photo': 'https://secure.gravatar.com/avatar/898d8d9942b44b34004e7df0f6b9e715?s=60&d=mm&r=pg', 'url': 'http://www.merrytummy.blogspot.com/'}, {'url_text': 'Nora @ Savory Nothings', 'fn': 'Nora @ Savory Nothings', 'photo': 'https://secure.gravatar.com/avatar/3f617daf9b365f22fd434f035c0ce810?s=60&d=mm&r=pg', 'url': 'http://www.savorynothings.com/'}, {'url_text': 'halfbakedharvest', 'fn': 'halfbakedharvest', 'nickname': 'halfbakedharvest', 'photo': 'https://secure.gravatar.com/avatar/49ee4a23a1d5dffb1944da32800bb254?s=60&d=mm&r=pg', 'url': 'https://www.halfbakedharvest.com/'}, {'url_text': 'foodnerd4life', 'fn': 'foodnerd4life', 'photo': 'https://secure.gravatar.com/avatar/6c9956c9e849dffd031778909d4e1012?s=60&d=mm&r=pg', 'url': 'http://foodnerd4life.com/'}], 'cse_thumbnail': [{'src': 'https://encrypted-tbn1.gstatic.com/images?q=tbn:ANd9GcTdZV6o1hFB9D5P7cXpfV4IlhFe1YJebGKGTNb52c3C_zWbIWQ_t1_fUTM', 'width': '183', 'height': '275'}], 'recipe': [{'image_url': 'https://www.halfbakedharvest.com/wp-content/uploads/2014/10/Salted-Caramel-Apple-Snickers-Cake.-1.jpg', 'cooktime': '45 min', 'calories': '886 kcal', 'preptime': '60 min'}, {'image': 'https://www.halfbakedharvest.com/wp-content/uploads/2014/10/Salted-Caramel-Apple-Snickers-Cake.-1.jpg', 'recipeingredient': '2 1/4 cup all-purpose flour', 'recipeinstructions': 'Preheat the oven to 350 degrees F. Grease three 8-inch (or 9 inch) round cake pans. Line with parchment paper, then butter/spray with cooking spray.', 'totaltime': 'PT240M', 'author': 'halfbakedharvest', 'name': 'Salted Caramel Apple Snickers Cake.', 'description': ""It has a little spook factor to it, the caramel apples and the whole Snickers thing makes it a dead ringer for Halloween, when everything is all about candy. Although, I didn't actually use..."", 'cooktime': 'PT45M', 'datepublished': '2014-10-17 02:00:20', 'preptime': 'PT60M', 'recipeyield': '16 Servings'}], 'hrecipe': [{'summary': ""It has a little spook factor to it, the caramel apples and the whole Snickers thing makes it a dead ringer for Halloween, when everything is all about candy. Although, I didn't actually use..."", 'author': 'halfbakedharvest', 'yield': '16 Servings', 'fn': 'Salted Caramel Apple Snickers Cake.', 'photo': 'https://www.halfbakedharvest.com/wp-content/uploads/2014/10/Salted-Caramel-Apple-Snickers-Cake.-1.jpg', 'published': '2014-10-17', 'calories': '886 kcal'}], 'metatags': [{'msapplication-config': 'https://www.halfbakedharvest.com/wp-content/themes/LoveInspired/images/browserconfig.xml', 'og:image': 'https://www.halfbakedharvest.com/wp-content/uploads/2014/10/Salted-Caramel-Apple-Snickers-Cake.-1.jpg', 'theme-color': '#c6afa5', 'article:published_time': '2014-10-17T08:00:20+00:00', 'og:image:width': '600', 'twitter:card': 'summary', 'og:site_name': 'Half Baked Harvest', 'twitter:label1': 'Written by', 'twitter:label2': 'Est. reading time', 'og:description': 'Made with Love', 'twitter:creator': '@hbharvest', 'article:publisher': 'https://www.facebook.com/hbharvest', 'twitter:data1': 'halfbakedharvest', 'twitter:image': 'https://www.halfbakedharvest.com/wp-content/uploads/2014/10/Salted-Caramel-Apple-Snickers-Cake.-1.jpg', 'twitter:data2': '9 minutes', 'twitter:site': '@hbharvest', 'article:modified_time': '2019-11-28T03:50:30+00:00', 'og:type': 'article', 'twitter:title': 'Salted Caramel Apple Snickers Cake | Half Baked Harvest', 'og:title': 'Salted Caramel Apple Snickers Cake | Half Baked Harvest', 'og:image:height': '900', 'pinterest': 'nohover', 'og:updated_time': '2019-11-27T20:50:30+00:00', 'viewport': 'width=device-width, initial-scale=1', 'twitter:description': 'Looking for a fall dessert to die for? This Salted Caramel Apple Snickers Cake from halfbakedharvest.com will have your guests salivating at first sight!', 'og:locale': 'en_US', 'og:url': 'https://www.halfbakedharvest.com/salted-caramel-apple-snickers-cake/'}], 'cse_image': [{'src': 'https://www.halfbakedharvest.com/wp-content/uploads/2014/10/Salted-Caramel-Apple-Snickers-Cake.-1.jpg'}], 'blog': [{'logo': 'https://www.halfbakedharvest.com/wp-content/themes/LoveInspired/images/logo.png'}], 'nutritioninformation': [{'calories': '886 kcal'}]}",off,0.535399,11,"[{'src': 'https://encrypted-tbn1.gstatic.com/images?q=tbn:ANd9GcTdZV6o1hFB9D5P7cXpfV4IlhFe1YJebGKGTNb52c3C_zWbIWQ_t1_fUTM', 'width': '183', 'height': '275'}]",,,"[{'image_url': 'https://www.halfbakedharvest.com/wp-content/uploads/2014/10/Salted-Caramel-Apple-Snickers-Cake.-1.jpg', 'cooktime': '45 min', 'calories': '886 kcal', 'preptime': '60 min'}, {'image': 'https://www.halfbakedharvest.com/wp-content/uploads/2014/10/Salted-Caramel-Apple-Snickers-Cake.-1.jpg', 'recipeingredient': '2 1/4 cup all-purpose flour', 'recipeinstructions': 'Preheat the oven to 350 degrees F. Grease three 8-inch (or 9 inch) round cake pans. Line with parchment paper, then butter/spray with cooking spray.', 'totaltime': 'PT240M', 'author': 'halfbakedharvest', 'name': 'Salted Caramel Apple Snickers Cake.', 'description': ""It has a little spook factor to it, the caramel apples and the whole Snickers thing makes it a dead ringer for Halloween, when everything is all about candy. Although, I didn't actually use..."", 'cooktime': 'PT45M', 'datepublished': '2014-10-17 02:00:20', 'preptime': 'PT60M', 'recipeyield': '16 Servings'}]","[{'summary': ""It has a little spook factor to it, the caramel apples and the whole Snickers thing makes it a dead ringer for Halloween, when everything is all about candy. Although, I didn't actually use..."", 'author': 'halfbakedharvest', 'yield': '16 Servings', 'fn': 'Salted Caramel Apple Snickers Cake.', 'photo': 'https://www.halfbakedharvest.com/wp-content/uploads/2014/10/Salted-Caramel-Apple-Snickers-Cake.-1.jpg', 'published': '2014-10-17', 'calories': '886 kcal'}]","[{'msapplication-config': 'https://www.halfbakedharvest.com/wp-content/themes/LoveInspired/images/browserconfig.xml', 'og:image': 'https://www.halfbakedharvest.com/wp-content/uploads/2014/10/Salted-Caramel-Apple-Snickers-Cake.-1.jpg', 'theme-color': '#c6afa5', 'article:published_time': '2014-10-17T08:00:20+00:00', 'og:image:width': '600', 'twitter:card': 'summary', 'og:site_name': 'Half Baked Harvest', 'twitter:label1': 'Written by', 'twitter:label2': 'Est. reading time', 'og:description': 'Made with Love', 'twitter:creator': '@hbharvest', 'article:publisher': 'https://www.facebook.com/hbharvest', 'twitter:data1': 'halfbakedharvest', 'twitter:image': 'https://www.halfbakedharvest.com/wp-content/uploads/2014/10/Salted-Caramel-Apple-Snickers-Cake.-1.jpg', 'twitter:data2': '9 minutes', 'twitter:site': '@hbharvest', 'article:modified_time': '2019-11-28T03:50:30+00:00', 'og:type': 'article', 'twitter:title': 'Salted Caramel Apple Snickers Cake | Half Baked Harvest', 'og:title': 'Salted Caramel Apple Snickers Cake | Half Baked Harvest', 'og:image:height': '900', 'pinterest': 'nohover', 'og:updated_time': '2019-11-27T20:50:30+00:00', 'viewport': 'width=device-width, initial-scale=1', 'twitter:description': 'Looking for a fall dessert to die for? This Salted Caramel Apple Snickers Cake from halfbakedharvest.com will have your guests salivating at first sight!', 'og:locale': 'en_US', 'og:url': 'https://www.halfbakedharvest.com/salted-caramel-apple-snickers-cake/'}]",,[{'src': 'https://www.halfbakedharvest.com/wp-content/uploads/2014/10/Salted-Caramel-Apple-Snickers-Cake.-1.jpg'}],,[{'calories': '886 kcal'}],"[{'url_text': 'Suné Moolman', 'fn': 'Suné Moolman', 'photo': 'https://secure.gravatar.com/avatar/55673da631a79d6b7b6adb138ade0bf6?s=60&d=mm&r=pg', 'url': 'http://gravatar.com/addsomebutter'}, {'url_text': 'halfbakedharvest', 'fn': 'halfbakedharvest', 'nickname': 'halfbakedharvest', 'photo': 'https://secure.gravatar.com/avatar/49ee4a23a1d5dffb1944da32800bb254?s=60&d=mm&r=pg', 'url': 'https://www.halfbakedharvest.com/'}, {'url_text': 'Siunna', 'fn': 'Siunna', 'nickname': 'Siunna', 'photo': 'https://secure.gravatar.com/avatar/4f95f250fe136bba0fb5db50a458eecc?s=60&d=mm&r=pg', 'url': 'http://www.siunna.com/'}, {'url_text': 'halfbakedharvest', 'fn': 'halfbakedharvest', 'nickname': 'halfbakedharvest', 'photo': 'https://secure.gravatar.com/avatar/49ee4a23a1d5dffb1944da32800bb254?s=60&d=mm&r=pg', 'url': 'https://www.halfbakedharvest.com/'}, {'fn': 'tracy', 'nickname': 'tracy', 'photo': 'https://secure.gravatar.com/avatar/437ab4349bab99a0c3703faf8b43e6b5?s=60&d=mm&r=pg'}, {'url_text': 'halfbakedharvest', 'fn': 'halfbakedharvest', 'nickname': 'halfbakedharvest', 'photo': 'https://secure.gravatar.com/avatar/49ee4a23a1d5dffb1944da32800bb254?s=60&d=mm&r=pg', 'url': 'https://www.halfbakedharvest.com/'}, {'url_text': 'shweta a', 'fn': 'shweta a', 'photo': 'https://secure.gravatar.com/avatar/898d8d9942b44b34004e7df0f6b9e715?s=60&d=mm&r=pg', 'url': 'http://www.merrytummy.blogspot.com/'}, {'url_text': 'Nora @ Savory Nothings', 'fn': 'Nora @ Savory Nothings', 'photo': 'https://secure.gravatar.com/avatar/3f617daf9b365f22fd434f035c0ce810?s=60&d=mm&r=pg', 'url': 'http://www.savorynothings.com/'}, {'url_text': 'halfbakedharvest', 'fn': 'halfbakedharvest', 'nickname': 'halfbakedharvest', 'photo': 'https://secure.gravatar.com/avatar/49ee4a23a1d5dffb1944da32800bb254?s=60&d=mm&r=pg', 'url': 'https://www.halfbakedharvest.com/'}, {'url_text': 'foodnerd4life', 'fn': 'foodnerd4life', 'photo': 'https://secure.gravatar.com/avatar/6c9956c9e849dffd031778909d4e1012?s=60&d=mm&r=pg', 'url': 'http://foodnerd4life.com/'}]",[{'logo': 'https://www.halfbakedharvest.com/wp-content/themes/LoveInspired/images/logo.png'}],,,https://www.halfbakedharvest.com/wp-content/uploads/2014/10/Salted-Caramel-Apple-Snickers-Cake.-1.jpg,article,,summary,Half Baked Harvest,"width=device-width, initial-scale=1",,Salted Caramel Apple Snickers Cake | Half Baked Harvest,https://www.halfbakedharvest.com/salted-caramel-apple-snickers-cake/,,Made with Love,,2014-10-17T08:00:20+00:00,600,,900,Written by,Est. reading time,@hbharvest,halfbakedharvest,9 minutes,@hbharvest,2019-11-28T03:50:30+00:00,en_US,,https://www.halfbakedharvest.com/wp-content/uploads/2014/10/Salted-Caramel-Apple-Snickers-Cake.-1.jpg,,,Salted Caramel Apple Snickers Cake | Half Baked Harvest,Looking for a fall dessert to die for? This Salted Caramel Apple Snickers Cake from halfbakedharvest.com will have your guests salivating at first sight!,https://www.halfbakedharvest.com/wp-content/themes/LoveInspired/images/browserconfig.xml,#c6afa5,https://www.facebook.com/hbharvest,nohover,2019-11-27T20:50:30+00:00,,,,,,,,,,,,,,
