6,1,us,Apple,7,Spiced Apple Cider Cranberry Cupcakes,"Dec 1, 2014 ... Spiced Apple Cider Cranberry Cupcakes are moist apple cider cake filled with 
spiced cranberry sauce, topped with a cinnamon cream cheese ...",www.americanheritagecooking.com,https://www.americanheritagecooking.com/2014/12/spiced-apple-cider-cranberry-cupcakes/,2020-12-29 12:16:34.993750+00:00,11300000,A3jYUIZe7DIJ,10,Holisticseo.digital,7b8760de16d1e86bc,0.54,"11,300,000",https://www.americanheritagecooking.com/.../spiced-apple-cider-cranberry- cupcakes/,https://www.americanheritagecooking.com/.../spiced-<b>apple</b>-cider-cranberry- cupcakes/,"Dec 1, 2014 <b>...</b> Spiced <b>Apple</b> Cider Cranberry Cupcakes are moist <b>apple</b> cider cake filled with <br>
spiced cranberry sauce, topped with a cinnamon cream cheese&nbsp;...",Spiced <b>Apple</b> Cider Cranberry Cupcakes,utf8,customsearch#result,utf8,"{'cse_thumbnail': [{'src': 'https://encrypted-tbn1.gstatic.com/images?q=tbn:ANd9GcRGgT_I-aqnXMZ5mXDJt3n0rr-CmSYfdHWzESgsK6m4FFAlH93kCZZdAGg', 'width': '225', 'height': '225'}], 'recipe': [{'totaltime': '75 min', 'image_url': 'https://cheflindseyfarr.com/wp-content/uploads/2014/12/Spiced-Apple-Cider-Cranberry-Cupcakes-1411166118.jpg'}, {'image': 'https://cheflindseyfarr.com/wp-content/uploads/2014/12/Spiced-Apple-Cider-Cranberry-Cupcakes-1411166118.jpg', 'copyrightholder': 'All images and content are copyright protected. Please do not use my images without prior permission. If you want to republish this recipe, please re-write the recipe in your own words, or...', 'recipeinstructions': 'Preheat the oven 350°. Line standard muffin tins with cupcake liners.', 'totaltime': 'PT1H15M', 'name': 'Spiced Apple Cider Cranberry Cupcakes', 'description': 'A soft, melt in your mouth, apple cider cinnamon cake is filled with an apple cider cranberry sauce, topped with a swirl of cinnamon cream cheese frosting and adorned with cinnamon sugar pie...', 'ingredients': '2 cups all-purpose flour', 'recipeyield': '14 Cupcakes'}], 'hrecipe': [{'summary': 'A soft, melt in your mouth, apple cider cinnamon cake is filled with an apple cider cranberry sauce, topped with a swirl of cinnamon cream cheese frosting and adorned with cinnamon sugar pie...', 'yield': '14 Cupcakes', 'fn': 'Spiced Apple Cider Cranberry Cupcakes', 'photo': 'https://cheflindseyfarr.com/wp-content/uploads/2014/12/Spiced-Apple-Cider-Cranberry-Cupcakes-1411166118.jpg'}], 'metatags': [{'p:domain_verify': 'c0d8ad4173b3940404554983fb2b4e01', 'twitter:card': 'summary', 'twitter:title': 'Spiced Apple Cider Cranberry Cupcakes', 'twitter:label1': 'Written by', 'twitter:label2': 'Est. reading time', 'msapplication-tileimage': 'https://www.americanheritagecooking.com/wp-content/uploads/2020/07/cropped-Chef_Short_RGB_Black-270x270.png', 'twitter:creator': '@cheflindseyfarr', 'twitter:image': 'https://www.americanheritagecooking.com/wp-content/uploads/2014/12/Spiced-Apple-Cider-Cranberry-Cupcakes-1411166141.jpg', 'twitter:data1': 'Lindsey', 'twitter:data2': '2 minutes', 'twitter:site': '@cheflindseyfarr', 'viewport': 'width=device-width, initial-scale=1', 'twitter:description': 'Spiced Apple Cider Cranberry Cupcakes are moist apple cider cake filled with spiced cranberry sauce, topped with a cinnamon cream cheese butter cream!'}], 'cse_image': [{'src': 'https://www.americanheritagecooking.com/wp-content/uploads/2014/12/Spiced-Apple-Cider-Cranberry-Cupcakes-1411166141.jpg'}]}",off,0.539251,1,"[{'src': 'https://encrypted-tbn1.gstatic.com/images?q=tbn:ANd9GcRGgT_I-aqnXMZ5mXDJt3n0rr-CmSYfdHWzESgsK6m4FFAlH93kCZZdAGg', 'width': '225', 'height': '225'}]",,,"[{'totaltime': '75 min', 'image_url': 'https://cheflindseyfarr.com/wp-content/uploads/2014/12/Spiced-Apple-Cider-Cranberry-Cupcakes-1411166118.jpg'}, {'image': 'https://cheflindseyfarr.com/wp-content/uploads/2014/12/Spiced-Apple-Cider-Cranberry-Cupcakes-1411166118.jpg', 'copyrightholder': 'All images and content are copyright protected. Please do not use my images without prior permission. If you want to republish this recipe, please re-write the recipe in your own words, or...', 'recipeinstructions': 'Preheat the oven 350°. Line standard muffin tins with cupcake liners.', 'totaltime': 'PT1H15M', 'name': 'Spiced Apple Cider Cranberry Cupcakes', 'description': 'A soft, melt in your mouth, apple cider cinnamon cake is filled with an apple cider cranberry sauce, topped with a swirl of cinnamon cream cheese frosting and adorned with cinnamon sugar pie...', 'ingredients': '2 cups all-purpose flour', 'recipeyield': '14 Cupcakes'}]","[{'summary': 'A soft, melt in your mouth, apple cider cinnamon cake is filled with an apple cider cranberry sauce, topped with a swirl of cinnamon cream cheese frosting and adorned with cinnamon sugar pie...', 'yield': '14 Cupcakes', 'fn': 'Spiced Apple Cider Cranberry Cupcakes', 'photo': 'https://cheflindseyfarr.com/wp-content/uploads/2014/12/Spiced-Apple-Cider-Cranberry-Cupcakes-1411166118.jpg'}]","[{'p:domain_verify': 'c0d8ad4173b3940404554983fb2b4e01', 'twitter:card': 'summary', 'twitter:title': 'Spiced Apple Cider Cranberry Cupcakes', 'twitter:label1': 'Written by', 'twitter:label2': 'Est. reading time', 'msapplication-tileimage': 'https://www.americanheritagecooking.com/wp-content/uploads/2020/07/cropped-Chef_Short_RGB_Black-270x270.png', 'twitter:creator': '@cheflindseyfarr', 'twitter:image': 'https://www.americanheritagecooking.com/wp-content/uploads/2014/12/Spiced-Apple-Cider-Cranberry-Cupcakes-1411166141.jpg', 'twitter:data1': 'Lindsey', 'twitter:data2': '2 minutes', 'twitter:site': '@cheflindseyfarr', 'viewport': 'width=device-width, initial-scale=1', 'twitter:description': 'Spiced Apple Cider Cranberry Cupcakes are moist apple cider cake filled with spiced cranberry sauce, topped with a cinnamon cream cheese butter cream!'}]",,[{'src': 'https://www.americanheritagecooking.com/wp-content/uploads/2014/12/Spiced-Apple-Cider-Cranberry-Cupcakes-1411166141.jpg'}],,,,,,,,,,summary,,"width=device-width, initial-scale=1",,,,,,,,,,,Written by,Est. reading time,@cheflindseyfarr,Lindsey,2 minutes,@cheflindseyfarr,,,https://www.americanheritagecooking.com/wp-content/uploads/2020/07/cropped-Chef_Short_RGB_Black-270x270.png,https://www.americanheritagecooking.com/wp-content/uploads/2014/12/Spiced-Apple-Cider-Cranberry-Cupcakes-1411166141.jpg,,c0d8ad4173b3940404554983fb2b4e01,Spiced Apple Cider Cranberry Cupcakes,"Spiced Apple Cider Cranberry Cupcakes are moist apple cider cake filled with spiced cranberry sauce, topped with a cinnamon cream cheese butter cream!",,,,,,,,,,,,,,,,,,,
7,1,us,Apple,8,Ginger Apple Moscow Mule. - Half Baked Harvest,"Oct 24, 2020 ... Vodka mixed with fresh lime juice, apple cider, sweet apple butter, fresh ginger, 
and topped off with ginger beer. For just a touch of sweetness ...",www.halfbakedharvest.com,https://www.halfbakedharvest.com/ginger-apple-moscow-mule/,2020-12-29 12:16:34.993750+00:00,11300000,pppTXBkLjbYJ,10,Holisticseo.digital,7b8760de16d1e86bc,0.54,"11,300,000",https://www.halfbakedharvest.com/ginger-apple-moscow-mule/,https://www.halfbakedharvest.com/ginger-<b>apple</b>-moscow-mule/,"Oct 24, 2020 <b>...</b> Vodka mixed with fresh lime juice, <b>apple</b> cider, sweet <b>apple</b> butter, fresh ginger, <br>
and topped off with ginger beer. For just a touch of sweetness&nbsp;...",Ginger <b>Apple</b> Moscow Mule. - Half Baked Harvest,utf8,customsearch#result,utf8,"{'hcard': [{'url_text': 'Huy Hoa', 'fn': 'Huy Hoa', 'photo': 'https://secure.gravatar.com/avatar/0cc4bf6913ba777860759641d2bb5d57?s=60&d=mm&r=pg', 'url': 'https://huyhoa.net/en/home/'}, {'url_text': 'halfbakedharvest', 'fn': 'halfbakedharvest', 'nickname': 'halfbakedharvest', 'photo': 'https://secure.gravatar.com/avatar/49ee4a23a1d5dffb1944da32800bb254?s=60&d=mm&r=pg', 'url': 'https://www.halfbakedharvest.com/'}, {'fn': 'Jenn', 'nickname': 'Jenn', 'photo': 'https://secure.gravatar.com/avatar/3530e612bd8c0743e2406e01c003091d?s=60&d=mm&r=pg'}, {'url_text': 'halfbakedharvest', 'fn': 'halfbakedharvest', 'nickname': 'halfbakedharvest', 'photo': 'https://secure.gravatar.com/avatar/49ee4a23a1d5dffb1944da32800bb254?s=60&d=mm&r=pg', 'url': 'https://www.halfbakedharvest.com/'}, {'fn': 'Christine Holly', 'photo': 'https://secure.gravatar.com/avatar/50511e2c1fefc7ef0036fe0d96107bc3?s=60&d=mm&r=pg'}, {'url_text': 'halfbakedharvest', 'fn': 'halfbakedharvest', 'nickname': 'halfbakedharvest', 'photo': 'https://secure.gravatar.com/avatar/49ee4a23a1d5dffb1944da32800bb254?s=60&d=mm&r=pg', 'url': 'https://www.halfbakedharvest.com/'}, {'fn': 'Rachelle', 'nickname': 'Rachelle', 'photo': 'https://secure.gravatar.com/avatar/2a60b23e5cc38a0da20a809a734bfd67?s=60&d=mm&r=pg'}, {'url_text': 'halfbakedharvest', 'fn': 'halfbakedharvest', 'nickname': 'halfbakedharvest', 'photo': 'https://secure.gravatar.com/avatar/49ee4a23a1d5dffb1944da32800bb254?s=60&d=mm&r=pg', 'url': 'https://www.halfbakedharvest.com/'}, {'fn': 'Pauline', 'nickname': 'Pauline', 'photo': 'https://secure.gravatar.com/avatar/5647e3c6f6f7435fe5fd3d7845300046?s=60&d=mm&r=pg'}, {'url_text': 'halfbakedharvest', 'fn': 'halfbakedharvest', 'nickname': 'halfbakedharvest', 'photo': 'https://secure.gravatar.com/avatar/49ee4a23a1d5dffb1944da32800bb254?s=60&d=mm&r=pg', 'url': 'https://www.halfbakedharvest.com/'}], 'cse_thumbnail': [{'src': 'https://encrypted-tbn0.gstatic.com/images?q=tbn:ANd9GcQ4OdYGTM2yMWAagiVX3CxS1tJTdc2aa-8EshC4aS--1NfH3fMub0e9sP4', 'width': '183', 'height': '275'}], 'recipe': [{'totaltime': '5 min', 'image_url': 'https://www.halfbakedharvest.com/wp-content/uploads/2020/10/Ginger-Apple-Moscow-Mule-1.jpg', 'calories': '200 kcal', 'preptime': '5 min'}, {'image': 'https://www.halfbakedharvest.com/wp-content/uploads/2020/10/Ginger-Apple-Moscow-Mule-1.jpg', 'recipeingredient': '2 ounces vodka', 'recipeinstructions': '1. Fill a cocktail glass with ice. 2. Combine the vodka, lime juice, apple cider, apple butter, and ginger in a cocktail shaker. Fill with ice and shake until combined, about 1 minute. Strain...', 'totaltime': 'PT5M', 'author': 'halfbakedharvest', 'name': 'Ginger Apple Moscow Mule', 'description': 'A delicious autumn twist on the classic. Spicy and warming...perfect for cozy autumn nights plus upcoming holidays!', 'datepublished': '2020-10-24 02:00:55', 'preptime': 'PT5M', 'recipeyield': '1 drink'}, {'image': 'https://www.halfbakedharvest.com/wp-content/uploads/2020/10/Ginger-Apple-Moscow-Mule-1.jpg', 'recipeingredient': '1 cup (8 ounces) vodka', 'recipeinstructions': '1. Combine the vodka, lime juice, apple cider, apple butter, and ginger in a large pitcher. Stir to combine and chill for 2 hours. 2. When ready to serve, fill the pitcher with ice and top...', 'totaltime': 'PT5M', 'author': 'halfbakedharvest', 'name': 'Ginger Apple Moscow Mule Punch', 'description': 'A delicious autumn twist on the classic. Spicy and warming...perfect for cozy autumn nights plus upcoming holidays!', 'datepublished': '2020-10-24 02:00:55', 'preptime': 'PT5M', 'recipeyield': '4 drinks'}], 'hrecipe': [{'summary': 'A delicious autumn twist on the classic. Spicy and warming...perfect for cozy autumn nights plus upcoming holidays!', 'author': 'halfbakedharvest', 'yield': '1 drink', 'fn': 'Ginger Apple Moscow Mule', 'photo': 'https://www.halfbakedharvest.com/wp-content/uploads/2020/10/Ginger-Apple-Moscow-Mule-1.jpg', 'published': '2020-10-24', 'calories': '200 kcal'}, {'summary': 'A delicious autumn twist on the classic. Spicy and warming...perfect for cozy autumn nights plus upcoming holidays!', 'author': 'halfbakedharvest', 'yield': '4 drinks', 'fn': 'Ginger Apple Moscow Mule Punch', 'photo': 'https://www.halfbakedharvest.com/wp-content/uploads/2020/10/Ginger-Apple-Moscow-Mule-1.jpg', 'published': '2020-10-24', 'calories': '200 kcal'}], 'metatags': [{'msapplication-config': 'https://www.halfbakedharvest.com/wp-content/themes/LoveInspired/images/browserconfig.xml', 'og:image': 'https://www.halfbakedharvest.com/wp-content/uploads/2020/10/Ginger-Apple-Moscow-Mule-1.jpg', 'theme-color': '#c6afa5', 'article:published_time': '2020-10-24T08:00:55+00:00', 'og:image:width': '1200', 'twitter:card': 'summary', 'og:site_name': 'Half Baked Harvest', 'twitter:label1': 'Written by', 'twitter:label2': 'Est. reading time', 'og:description': 'Made with Love', 'twitter:creator': '@hbharvest', 'article:publisher': 'https://www.facebook.com/hbharvest', 'twitter:data1': 'halfbakedharvest', 'twitter:image': 'https://www.halfbakedharvest.com/wp-content/uploads/2020/10/Ginger-Apple-Moscow-Mule-1.jpg', 'twitter:data2': '3 minutes', 'twitter:site': '@hbharvest', 'article:modified_time': '2020-11-06T03:40:54+00:00', 'og:type': 'article', 'twitter:title': 'Ginger Apple Moscow Mule.', 'og:title': 'Ginger Apple Moscow Mule. - Half Baked Harvest', 'og:image:height': '1800', 'pinterest': 'nohover', 'og:updated_time': '2020-11-05T20:40:54+00:00', 'viewport': 'width=device-width, initial-scale=1', 'twitter:description': 'Ginger Apple Moscow Mule. A delicious autumn twist on the classic. Spicy and warming...perfect for cozy autumn nights plus upcoming holidays!', 'og:locale': 'en_US', 'og:url': 'https://www.halfbakedharvest.com/ginger-apple-moscow-mule/'}], 'cse_image': [{'src': 'https://www.halfbakedharvest.com/wp-content/uploads/2020/10/Ginger-Apple-Moscow-Mule-1.jpg'}], 'blog': [{'logo': 'https://www.halfbakedharvest.com/wp-content/themes/LoveInspired/images/logo.png'}], 'nutritioninformation': [{'calories': '200 kcal'}, {'calories': '200 kcal'}]}",off,0.539251,1,"[{'src': 'https://encrypted-tbn0.gstatic.com/images?q=tbn:ANd9GcQ4OdYGTM2yMWAagiVX3CxS1tJTdc2aa-8EshC4aS--1NfH3fMub0e9sP4', 'width': '183', 'height': '275'}]",,,"[{'totaltime': '5 min', 'image_url': 'https://www.halfbakedharvest.com/wp-content/uploads/2020/10/Ginger-Apple-Moscow-Mule-1.jpg', 'calories': '200 kcal', 'preptime': '5 min'}, {'image': 'https://www.halfbakedharvest.com/wp-content/uploads/2020/10/Ginger-Apple-Moscow-Mule-1.jpg', 'recipeingredient': '2 ounces vodka', 'recipeinstructions': '1. Fill a cocktail glass with ice. 2. Combine the vodka, lime juice, apple cider, apple butter, and ginger in a cocktail shaker. Fill with ice and shake until combined, about 1 minute. Strain...', 'totaltime': 'PT5M', 'author': 'halfbakedharvest', 'name': 'Ginger Apple Moscow Mule', 'description': 'A delicious autumn twist on the classic. Spicy and warming...perfect for cozy autumn nights plus upcoming holidays!', 'datepublished': '2020-10-24 02:00:55', 'preptime': 'PT5M', 'recipeyield': '1 drink'}, {'image': 'https://www.halfbakedharvest.com/wp-content/uploads/2020/10/Ginger-Apple-Moscow-Mule-1.jpg', 'recipeingredient': '1 cup (8 ounces) vodka', 'recipeinstructions': '1. Combine the vodka, lime juice, apple cider, apple butter, and ginger in a large pitcher. Stir to combine and chill for 2 hours. 2. When ready to serve, fill the pitcher with ice and top...', 'totaltime': 'PT5M', 'author': 'halfbakedharvest', 'name': 'Ginger Apple Moscow Mule Punch', 'description': 'A delicious autumn twist on the classic. Spicy and warming...perfect for cozy autumn nights plus upcoming holidays!', 'datepublished': '2020-10-24 02:00:55', 'preptime': 'PT5M', 'recipeyield': '4 drinks'}]","[{'summary': 'A delicious autumn twist on the classic. Spicy and warming...perfect for cozy autumn nights plus upcoming holidays!', 'author': 'halfbakedharvest', 'yield': '1 drink', 'fn': 'Ginger Apple Moscow Mule', 'photo': 'https://www.halfbakedharvest.com/wp-content/uploads/2020/10/Ginger-Apple-Moscow-Mule-1.jpg', 'published': '2020-10-24', 'calories': '200 kcal'}, {'summary': 'A delicious autumn twist on the classic. Spicy and warming...perfect for cozy autumn nights plus upcoming holidays!', 'author': 'halfbakedharvest', 'yield': '4 drinks', 'fn': 'Ginger Apple Moscow Mule Punch', 'photo': 'https://www.halfbakedharvest.com/wp-content/uploads/2020/10/Ginger-Apple-Moscow-Mule-1.jpg', 'published': '2020-10-24', 'calories': '200 kcal'}]","[{'msapplication-config': 'https://www.halfbakedharvest.com/wp-content/themes/LoveInspired/images/browserconfig.xml', 'og:image': 'https://www.halfbakedharvest.com/wp-content/uploads/2020/10/Ginger-Apple-Moscow-Mule-1.jpg', 'theme-color': '#c6afa5', 'article:published_time': '2020-10-24T08:00:55+00:00', 'og:image:width': '1200', 'twitter:card': 'summary', 'og:site_name': 'Half Baked Harvest', 'twitter:label1': 'Written by', 'twitter:label2': 'Est. reading time', 'og:description': 'Made with Love', 'twitter:creator': '@hbharvest', 'article:publisher': 'https://www.facebook.com/hbharvest', 'twitter:data1': 'halfbakedharvest', 'twitter:image': 'https://www.halfbakedharvest.com/wp-content/uploads/2020/10/Ginger-Apple-Moscow-Mule-1.jpg', 'twitter:data2': '3 minutes', 'twitter:site': '@hbharvest', 'article:modified_time': '2020-11-06T03:40:54+00:00', 'og:type': 'article', 'twitter:title': 'Ginger Apple Moscow Mule.', 'og:title': 'Ginger Apple Moscow Mule. - Half Baked Harvest', 'og:image:height': '1800', 'pinterest': 'nohover', 'og:updated_time': '2020-11-05T20:40:54+00:00', 'viewport': 'width=device-width, initial-scale=1', 'twitter:description': 'Ginger Apple Moscow Mule. A delicious autumn twist on the classic. Spicy and warming...perfect for cozy autumn nights plus upcoming holidays!', 'og:locale': 'en_US', 'og:url': 'https://www.halfbakedharvest.com/ginger-apple-moscow-mule/'}]",,[{'src': 'https://www.halfbakedharvest.com/wp-content/uploads/2020/10/Ginger-Apple-Moscow-Mule-1.jpg'}],,"[{'calories': '200 kcal'}, {'calories': '200 kcal'}]","[{'url_text': 'Huy Hoa', 'fn': 'Huy Hoa', 'photo': 'https://secure.gravatar.com/avatar/0cc4bf6913ba777860759641d2bb5d57?s=60&d=mm&r=pg', 'url': 'https://huyhoa.net/en/home/'}, {'url_text': 'halfbakedharvest', 'fn': 'halfbakedharvest', 'nickname': 'halfbakedharvest', 'photo': 'https://secure.gravatar.com/avatar/49ee4a23a1d5dffb1944da32800bb254?s=60&d=mm&r=pg', 'url': 'https://www.halfbakedharvest.com/'}, {'fn': 'Jenn', 'nickname': 'Jenn', 'photo': 'https://secure.gravatar.com/avatar/3530e612bd8c0743e2406e01c003091d?s=60&d=mm&r=pg'}, {'url_text': 'halfbakedharvest', 'fn': 'halfbakedharvest', 'nickname': 'halfbakedharvest', 'photo': 'https://secure.gravatar.com/avatar/49ee4a23a1d5dffb1944da32800bb254?s=60&d=mm&r=pg', 'url': 'https://www.halfbakedharvest.com/'}, {'fn': 'Christine Holly', 'photo': 'https://secure.gravatar.com/avatar/50511e2c1fefc7ef0036fe0d96107bc3?s=60&d=mm&r=pg'}, {'url_text': 'halfbakedharvest', 'fn': 'halfbakedharvest', 'nickname': 'halfbakedharvest', 'photo': 'https://secure.gravatar.com/avatar/49ee4a23a1d5dffb1944da32800bb254?s=60&d=mm&r=pg', 'url': 'https://www.halfbakedharvest.com/'}, {'fn': 'Rachelle', 'nickname': 'Rachelle', 'photo': 'https://secure.gravatar.com/avatar/2a60b23e5cc38a0da20a809a734bfd67?s=60&d=mm&r=pg'}, {'url_text': 'halfbakedharvest', 'fn': 'halfbakedharvest', 'nickname': 'halfbakedharvest', 'photo': 'https://secure.gravatar.com/avatar/49ee4a23a1d5dffb1944da32800bb254?s=60&d=mm&r=pg', 'url': 'https://www.halfbakedharvest.com/'}, {'fn': 'Pauline', 'nickname': 'Pauline', 'photo': 'https://secure.gravatar.com/avatar/5647e3c6f6f7435fe5fd3d7845300046?s=60&d=mm&r=pg'}, {'url_text': 'halfbakedharvest', 'fn': 'halfbakedharvest', 'nickname': 'halfbakedharvest', 'photo': 'https://secure.gravatar.com/avatar/49ee4a23a1d5dffb1944da32800bb254?s=60&d=mm&r=pg', 'url': 'https://www.halfbakedharvest.com/'}]",[{'logo': 'https://www.halfbakedharvest.com/wp-content/themes/LoveInspired/images/logo.png'}],,,https://www.halfbakedharvest.com/wp-content/uploads/2020/10/Ginger-Apple-Moscow-Mule-1.jpg,article,,summary,Half Baked Harvest,"width=device-width, initial-scale=1",,Ginger Apple Moscow Mule. - Half Baked Harvest,https://www.halfbakedharvest.com/ginger-apple-moscow-mule/,,Made with Love,,2020-10-24T08:00:55+00:00,1200,,1800,Written by,Est. reading time,@hbharvest,halfbakedharvest,3 minutes,@hbharvest,2020-11-06T03:40:54+00:00,en_US,,https://www.halfbakedharvest.com/wp-content/uploads/2020/10/Ginger-Apple-Moscow-Mule-1.jpg,,,Ginger Apple Moscow Mule.,Ginger Apple Moscow Mule. A delicious autumn twist on the classic. Spicy and warming...perfect for cozy autumn nights plus upcoming holidays!,https://www.halfbakedharvest.com/wp-content/themes/LoveInspired/images/browserconfig.xml,#c6afa5,https://www.facebook.com/hbharvest,nohover,2020-11-05T20:40:54+00:00,,,,,,,,,,,,,,
