,start,gl,searchTerms,rank,title,snippet,displayLink,link,queryTime,totalResults,cacheId,count,cseName,cx,formattedSearchTime,formattedTotalResults,formattedUrl,htmlFormattedUrl,htmlSnippet,htmlTitle,inputEncoding,kind,outputEncoding,pagemap,safe,searchTime,startIndex,cse_thumbnail,person,aggregaterating,recipe,hrecipe,metatags,videoobject,cse_image,howtostep,nutritioninformation,hcard,blog,listitem,usercomments,og:image,og:type,fb:app_id,twitter:card,og:site_name,viewport,onespot:page-type,og:title,og:url,gmi:topics,og:description,fb:pages,article:published_time,og:image:width,sitelock-site-verification,og:image:height,twitter:label1,twitter:label2,twitter:creator,twitter:data1,twitter:data2,twitter:site,article:modified_time,og:locale,msapplication-tileimage,twitter:image,twitter:text:title,p:domain_verify,twitter:title,twitter:description,msapplication-config,theme-color,article:publisher,pinterest,og:updated_time,og:image:secure_url,msapplication-tilecolor,article:section,article:tag,template,date,tags,recipetype,subtitle,category,mediatype,vicurrentdatetime,bingbot,article:author
0,1,us,Apple,1,Perfect Apple Pie Recipe - Pillsbury.com,"Our classic apple pie takes a shortcut with easy Pillsbury™ refrigerated pie crust! 
Baked with a filling of fresh apples and warm spices, there is as much simple ...",www.pillsbury.com,https://www.pillsbury.com/recipes/perfect-apple-pie/1fc2b60f-0a4f-441e-ad93-8bbd00fe5334,2020-12-29 12:16:34.993750+00:00,11300000,3J0TnbSLubEJ,10,Holisticseo.digital,7b8760de16d1e86bc,0.54,"11,300,000",https://www.pillsbury.com/...apple.../1fc2b60f-0a4f-441e-ad93- 8bbd00fe5334,https://www.pillsbury.com/...<b>apple</b>.../1fc2b60f-0a4f-441e-ad93- 8bbd00fe5334,"Our classic <b>apple</b> pie takes a shortcut with easy Pillsbury™ refrigerated pie crust! <br>
Baked with a filling of fresh <b>apples</b> and warm spices, there is as much simple&nbsp;...",Perfect <b>Apple</b> Pie Recipe - Pillsbury.com,utf8,customsearch#result,utf8,"{'cse_thumbnail': [{'src': 'https://encrypted-tbn1.gstatic.com/images?q=tbn:ANd9GcSsGYqyWwlj6ke9kciNppcKQkRS7QWVCnNx21H3g_FU5KsNTdlutU7IJPI', 'width': '300', 'height': '168'}], 'person': [{'name': 'Pillsbury Kitchens'}], 'aggregaterating': [{'ratingvalue': '4.5', 'ratingcount': '735', 'worstrating': '1', 'bestrating': '5'}], 'recipe': [{'ratingstars': '4.5', 'totaltime': '180 min', 'image_url': 'https://images-gmi-pmc.edge-generalmills.com/93621836-3f2d-43ae-9b02-6fa9196ec5d1.jpg', 'votes': '735', 'calories': '230', 'preptime': '30 min'}, {'image': 'https://images-gmi-pmc.edge-generalmills.com/93621836-3f2d-43ae-9b02-6fa9196ec5d1.jpg', 'recipeingredient': '1 box Pillsbury™ refrigerated pie crusts, softened as directed on box Save $', 'keywords': 'perfect apple pie', 'datemodified': '08/14/2019', 'totaltime': 'PT3H0M', 'recipecategory': 'Dessert', 'name': 'Perfect Apple Pie', 'description': 'Our classic apple pie takes a shortcut with easy Pillsbury™ refrigerated pie crust! Baked with a filling of fresh apples and warm spices, there is as much simple joy in preparing this pie...', 'datecreated': '01/03/2005', 'preptime': 'PT0H30M', 'recipeyield': '8'}], 'hrecipe': [{'summary': 'Our classic apple pie takes a shortcut with easy Pillsbury™ refrigerated pie crust! Baked with a filling of fresh apples and warm spices, there is as much simple joy in preparing this pie...', 'sodium': '200 mg', 'author': 'Pillsbury Kitchens', 'yield': '8', 'fn': 'Perfect Apple Pie', 'fat': '1', 'photo': 'https://images-gmi-pmc.edge-generalmills.com/93621836-3f2d-43ae-9b02-6fa9196ec5d1.jpg', 'cholesterol': '0 mg', 'calories': '230'}], 'metatags': [{'og:image': 'https://images-gmi-pmc.edge-generalmills.com/75593ed5-420b-4782-8eae-56bdfbc2586b.jpg', 'og:type': 'article', 'fb:app_id': '1425616401046719', 'twitter:card': 'summary', 'og:site_name': 'Pillsbury.com', 'viewport': 'width=device-width, initial-scale=1, user-scalable=0', 'onespot:page-type': 'Recipe', 'og:title': 'Perfect Apple Pie', 'og:url': 'https://www.pillsbury.com/recipes/perfect-apple-pie/1fc2b60f-0a4f-441e-ad93-8bbd00fe5334', 'gmi:topics': 'BAKING, Pillsbury Other RBG, ARPC PIE CRUST, Bake, Dessert, Pie Pan, Pie, Sweet, How To, DAP, Pie Dough, Apple, Pillsbury, PB RBG PIE CRUST, Dough, Fruit', 'og:description': 'Our classic apple pie takes a shortcut with easy Pillsbury™ refrigerated pie crust! Baked with a filling of fresh apples and warm spices, there is as much simple joy in preparing this pie as there is in eating it. Each bite makes your friends and family feel warm, cozy and like they’re wrapped in a hug. Whether you bake it for a holiday, a potluck or as a special weekend dessert, this timeless pie recipe is guaranteed to spark joy.'}], 'videoobject': [{'embedurl': 'https://www.youtube.com/embed/rIIYB-cg26s', 'contenturl': 'https://www.pillsbury.com/videos/perfect-apple-pie', 'uploaddate': '06/06/2018', 'name': 'How to Make Perfect Apple Pie Video', 'description': 'A classic apple pie takes a shortcut with easy Pillsbury® unroll-fill refrigerated pie crust.', 'thumbnailurl': 'https://images-gmi-pmc.edge-generalmills.com/14ccc9e3-8445-447e-b5b6-37873c4336c1.jpg'}], 'cse_image': [{'src': 'https://images-gmi-pmc.edge-generalmills.com/75593ed5-420b-4782-8eae-56bdfbc2586b.jpg'}], 'howtostep': [{'text': 'Heat oven to 425°F. Place 1 pie crust in ungreased 9-inch glass pie plate. Press firmly against side and bottom.'}, {'text': 'In large bowl, gently mix filling ingredients; spoon into crust-lined pie plate. Top with second crust. Wrap excess top crust under bottom crust edge, pressing edges together to seal; flute....'}, {'text': 'Bake 40 to 45 minutes or until apples are tender and crust is golden brown. Cover edge of crust with 2- to 3-inch wide strips of foil after first 15 to 20 minutes of baking to prevent excessive...'}], 'nutritioninformation': [{'fatcontent': '1', 'cholesterolcontent': '0 mg', 'fibercontent': '1 g', 'servingsize': '1 Serving', 'sodiumcontent': '200 mg', 'carbohydratecontent': '43 g', 'saturatedfatcontent': '2 1/2 g', 'sugarcontent': '27 g', 'proteincontent': '1 g', 'calories': '230', 'transfatcontent': '0 g'}]}",off,0.539251,1,"[{'src': 'https://encrypted-tbn1.gstatic.com/images?q=tbn:ANd9GcSsGYqyWwlj6ke9kciNppcKQkRS7QWVCnNx21H3g_FU5KsNTdlutU7IJPI', 'width': '300', 'height': '168'}]",[{'name': 'Pillsbury Kitchens'}],"[{'ratingvalue': '4.5', 'ratingcount': '735', 'worstrating': '1', 'bestrating': '5'}]","[{'ratingstars': '4.5', 'totaltime': '180 min', 'image_url': 'https://images-gmi-pmc.edge-generalmills.com/93621836-3f2d-43ae-9b02-6fa9196ec5d1.jpg', 'votes': '735', 'calories': '230', 'preptime': '30 min'}, {'image': 'https://images-gmi-pmc.edge-generalmills.com/93621836-3f2d-43ae-9b02-6fa9196ec5d1.jpg', 'recipeingredient': '1 box Pillsbury™ refrigerated pie crusts, softened as directed on box Save $', 'keywords': 'perfect apple pie', 'datemodified': '08/14/2019', 'totaltime': 'PT3H0M', 'recipecategory': 'Dessert', 'name': 'Perfect Apple Pie', 'description': 'Our classic apple pie takes a shortcut with easy Pillsbury™ refrigerated pie crust! Baked with a filling of fresh apples and warm spices, there is as much simple joy in preparing this pie...', 'datecreated': '01/03/2005', 'preptime': 'PT0H30M', 'recipeyield': '8'}]","[{'summary': 'Our classic apple pie takes a shortcut with easy Pillsbury™ refrigerated pie crust! Baked with a filling of fresh apples and warm spices, there is as much simple joy in preparing this pie...', 'sodium': '200 mg', 'author': 'Pillsbury Kitchens', 'yield': '8', 'fn': 'Perfect Apple Pie', 'fat': '1', 'photo': 'https://images-gmi-pmc.edge-generalmills.com/93621836-3f2d-43ae-9b02-6fa9196ec5d1.jpg', 'cholesterol': '0 mg', 'calories': '230'}]","[{'og:image': 'https://images-gmi-pmc.edge-generalmills.com/75593ed5-420b-4782-8eae-56bdfbc2586b.jpg', 'og:type': 'article', 'fb:app_id': '1425616401046719', 'twitter:card': 'summary', 'og:site_name': 'Pillsbury.com', 'viewport': 'width=device-width, initial-scale=1, user-scalable=0', 'onespot:page-type': 'Recipe', 'og:title': 'Perfect Apple Pie', 'og:url': 'https://www.pillsbury.com/recipes/perfect-apple-pie/1fc2b60f-0a4f-441e-ad93-8bbd00fe5334', 'gmi:topics': 'BAKING, Pillsbury Other RBG, ARPC PIE CRUST, Bake, Dessert, Pie Pan, Pie, Sweet, How To, DAP, Pie Dough, Apple, Pillsbury, PB RBG PIE CRUST, Dough, Fruit', 'og:description': 'Our classic apple pie takes a shortcut with easy Pillsbury™ refrigerated pie crust! Baked with a filling of fresh apples and warm spices, there is as much simple joy in preparing this pie as there is in eating it. Each bite makes your friends and family feel warm, cozy and like they’re wrapped in a hug. Whether you bake it for a holiday, a potluck or as a special weekend dessert, this timeless pie recipe is guaranteed to spark joy.'}]","[{'embedurl': 'https://www.youtube.com/embed/rIIYB-cg26s', 'contenturl': 'https://www.pillsbury.com/videos/perfect-apple-pie', 'uploaddate': '06/06/2018', 'name': 'How to Make Perfect Apple Pie Video', 'description': 'A classic apple pie takes a shortcut with easy Pillsbury® unroll-fill refrigerated pie crust.', 'thumbnailurl': 'https://images-gmi-pmc.edge-generalmills.com/14ccc9e3-8445-447e-b5b6-37873c4336c1.jpg'}]",[{'src': 'https://images-gmi-pmc.edge-generalmills.com/75593ed5-420b-4782-8eae-56bdfbc2586b.jpg'}],"[{'text': 'Heat oven to 425°F. Place 1 pie crust in ungreased 9-inch glass pie plate. Press firmly against side and bottom.'}, {'text': 'In large bowl, gently mix filling ingredients; spoon into crust-lined pie plate. Top with second crust. Wrap excess top crust under bottom crust edge, pressing edges together to seal; flute....'}, {'text': 'Bake 40 to 45 minutes or until apples are tender and crust is golden brown. Cover edge of crust with 2- to 3-inch wide strips of foil after first 15 to 20 minutes of baking to prevent excessive...'}]","[{'fatcontent': '1', 'cholesterolcontent': '0 mg', 'fibercontent': '1 g', 'servingsize': '1 Serving', 'sodiumcontent': '200 mg', 'carbohydratecontent': '43 g', 'saturatedfatcontent': '2 1/2 g', 'sugarcontent': '27 g', 'proteincontent': '1 g', 'calories': '230', 'transfatcontent': '0 g'}]",,,,,https://images-gmi-pmc.edge-generalmills.com/75593ed5-420b-4782-8eae-56bdfbc2586b.jpg,article,1425616401046719,summary,Pillsbury.com,"width=device-width, initial-scale=1, user-scalable=0",Recipe,Perfect Apple Pie,https://www.pillsbury.com/recipes/perfect-apple-pie/1fc2b60f-0a4f-441e-ad93-8bbd00fe5334,"BAKING, Pillsbury Other RBG, ARPC PIE CRUST, Bake, Dessert, Pie Pan, Pie, Sweet, How To, DAP, Pie Dough, Apple, Pillsbury, PB RBG PIE CRUST, Dough, Fruit","Our classic apple pie takes a shortcut with easy Pillsbury™ refrigerated pie crust! Baked with a filling of fresh apples and warm spices, there is as much simple joy in preparing this pie as there is in eating it. Each bite makes your friends and family feel warm, cozy and like they’re wrapped in a hug. Whether you bake it for a holiday, a potluck or as a special weekend dessert, this timeless pie recipe is guaranteed to spark joy.",,,,,,,,,,,,,,,,,,,,,,,,,,,,,,,,,,,,,,
1,1,us,Apple,2,Caramel Apple Cream Cheese Pie,"Nov 10, 2020 ... A spoonful of this holiday pie begins with a graham cracker crust followed by a 
layer of cream cheese, sweet apple pie filling, and finally, ...",www.campchef.com,https://www.campchef.com/recipes/caramel-apple-cream-cheese-pie/,2020-12-29 12:16:34.993750+00:00,11300000,9bhdAbWlIrwJ,10,Holisticseo.digital,7b8760de16d1e86bc,0.54,"11,300,000",https://www.campchef.com/recipes/caramel-apple-cream-cheese-pie/,https://www.campchef.com/recipes/caramel-<b>apple</b>-cream-cheese-pie/,"Nov 10, 2020 <b>...</b> A spoonful of this holiday pie begins with a graham cracker crust followed by a <br>
layer of cream cheese, sweet <b>apple</b> pie filling, and finally,&nbsp;...",Caramel <b>Apple</b> Cream Cheese Pie,utf8,customsearch#result,utf8,"{'cse_thumbnail': [{'src': 'https://encrypted-tbn1.gstatic.com/images?q=tbn:ANd9GcRVk8Vq6c_u8iMRbxoDBsfyhFMUNzPgNPER4E4_Il1KUTI_a2GA8nPlQuM', 'width': '297', 'height': '170'}], 'person': [{'name': 'Camp Chef'}], 'hrecipe': [{'summary': 'A spoonful of this holiday pie begins with a graham cracker crust followed by a layer of cream cheese, sweet apple pie filling, and finally, a caramel-drizzled crunchy crumb topping. Suggested...', 'author': 'Camp Chef', 'fn': 'Caramel Apple Cream Cheese Pie', 'photo': 'https://www.campchef.com/recipes/wp-content/uploads/2020/11/CreamCheeseApplePieFeatured-232x130.jpg', 'published': '2020-11-10'}], 'recipe': [{'image': 'https://www.campchef.com/recipes/wp-content/uploads/2020/11/CreamCheeseApplePieFeatured-232x130.jpg', 'recipeinstructions': 'For the Crust: Preheat pellet grill to 350 degrees F. In a medium bowl, add crumbled crackers and melted butter. Mix to combine. Press 1 1/2 cups of the mixture into the pie pan and bake on...', 'name': 'Caramel Apple Cream Cheese Pie', 'description': 'A spoonful of this holiday pie begins with a graham cracker crust followed by a layer of cream cheese, sweet apple pie filling, and finally, a caramel-drizzled crunchy crumb topping. Suggested...', 'ingredients': '2 cups graham crackers, crumbled', 'datepublished': '2020-11-10'}], 'metatags': [{'og:image': 'https://www.campchef.com/recipes/wp-content/uploads/2020/11/CreamCheeseApplePieFeatured-725x416.jpg', 'og:type': 'article', 'og:site_name': 'Camp Chef Recipes', 'viewport': 'width=device-width, initial-scale=1', 'og:title': 'Caramel Apple Cream Cheese Pie', 'og:url': 'https://www.campchef.com/recipes/caramel-apple-cream-cheese-pie/', 'og:description': 'A spoonful of this holiday pie begins with a graham cracker crust followed by a layer of cream cheese, sweet apple pie filling, and finally, a caramel-drizzled crunchy crumb topping.', 'fb:pages': '17777208879'}], 'cse_image': [{'src': 'https://www.campchef.com/recipes/wp-content/uploads/2020/11/CreamCheeseApplePieFeatured-725x416.jpg'}]}",off,0.539251,1,"[{'src': 'https://encrypted-tbn1.gstatic.com/images?q=tbn:ANd9GcRVk8Vq6c_u8iMRbxoDBsfyhFMUNzPgNPER4E4_Il1KUTI_a2GA8nPlQuM', 'width': '297', 'height': '170'}]",[{'name': 'Camp Chef'}],,"[{'image': 'https://www.campchef.com/recipes/wp-content/uploads/2020/11/CreamCheeseApplePieFeatured-232x130.jpg', 'recipeinstructions': 'For the Crust: Preheat pellet grill to 350 degrees F. In a medium bowl, add crumbled crackers and melted butter. Mix to combine. Press 1 1/2 cups of the mixture into the pie pan and bake on...', 'name': 'Caramel Apple Cream Cheese Pie', 'description': 'A spoonful of this holiday pie begins with a graham cracker crust followed by a layer of cream cheese, sweet apple pie filling, and finally, a caramel-drizzled crunchy crumb topping. Suggested...', 'ingredients': '2 cups graham crackers, crumbled', 'datepublished': '2020-11-10'}]","[{'summary': 'A spoonful of this holiday pie begins with a graham cracker crust followed by a layer of cream cheese, sweet apple pie filling, and finally, a caramel-drizzled crunchy crumb topping. Suggested...', 'author': 'Camp Chef', 'fn': 'Caramel Apple Cream Cheese Pie', 'photo': 'https://www.campchef.com/recipes/wp-content/uploads/2020/11/CreamCheeseApplePieFeatured-232x130.jpg', 'published': '2020-11-10'}]","[{'og:image': 'https://www.campchef.com/recipes/wp-content/uploads/2020/11/CreamCheeseApplePieFeatured-725x416.jpg', 'og:type': 'article', 'og:site_name': 'Camp Chef Recipes', 'viewport': 'width=device-width, initial-scale=1', 'og:title': 'Caramel Apple Cream Cheese Pie', 'og:url': 'https://www.campchef.com/recipes/caramel-apple-cream-cheese-pie/', 'og:description': 'A spoonful of this holiday pie begins with a graham cracker crust followed by a layer of cream cheese, sweet apple pie filling, and finally, a caramel-drizzled crunchy crumb topping.', 'fb:pages': '17777208879'}]",,[{'src': 'https://www.campchef.com/recipes/wp-content/uploads/2020/11/CreamCheeseApplePieFeatured-725x416.jpg'}],,,,,,,https://www.campchef.com/recipes/wp-content/uploads/2020/11/CreamCheeseApplePieFeatured-725x416.jpg,article,,,Camp Chef Recipes,"width=device-width, initial-scale=1",,Caramel Apple Cream Cheese Pie,https://www.campchef.com/recipes/caramel-apple-cream-cheese-pie/,,"A spoonful of this holiday pie begins with a graham cracker crust followed by a layer of cream cheese, sweet apple pie filling, and finally, a caramel-drizzled crunchy crumb topping.",17777208879,,,,,,,,,,,,,,,,,,,,,,,,,,,,,,,,,,,,,
2,1,us,Apple,3,The BEST Apple Crisp Shortbread Bars Recipe - Sober Julie,"Sep 21, 2015 ... Apple Filling: 3 large apples, peeled and thinly sliced; 2 Tablespoons all-purpose 
flour; 2 Tablespoons sugar; 1 teaspoon ground cinnamon; 1/4 ...",www.soberjulie.com,https://www.soberjulie.com/2015/09/apple-crisp-shortbread-bars/,2020-12-29 12:16:34.993750+00:00,11300000,UE1HXYsCLWMJ,10,Holisticseo.digital,7b8760de16d1e86bc,0.54,"11,300,000",https://www.soberjulie.com/2015/09/apple-crisp-shortbread-bars/,https://www.soberjulie.com/2015/09/<b>apple</b>-crisp-shortbread-bars/,"Sep 21, 2015 <b>...</b> <b>Apple</b> Filling: 3 large <b>apples</b>, peeled and thinly sliced; 2 Tablespoons all-purpose <br>
flour; 2 Tablespoons sugar; 1 teaspoon ground cinnamon; 1/4&nbsp;...",The BEST <b>Apple</b> Crisp Shortbread Bars Recipe - Sober Julie,utf8,customsearch#result,utf8,"{'hcard': [{'url_text': '21 Easy Fall Dessert Recipes For A Crowd & Make You Feel Cozy!', 'fn': '21 Easy Fall Dessert Recipes For A Crowd & Make You Feel Cozy!', 'url': 'https://www.crispyfoodidea.com/2020/07/easy-fall-dessert-recipe-for-a-crowd.html'}], 'cse_thumbnail': [{'src': 'https://encrypted-tbn3.gstatic.com/images?q=tbn:ANd9GcTBi2177CT70XHYMvj4qJNb_uySsfGDq61Z36c3chBJqAqA3UjFdIdkeFS1', 'width': '272', 'height': '185'}], 'aggregaterating': [{'ratingvalue': '4.8', 'ratingcount': '37'}], 'recipe': [{'ratingstars': '5.0', 'image_url': 'https://cdn.shortpixel.ai/client/to_avif,q_lossy,ret_img,w_480/https://www.soberjulie.com/wp-content/uploads/2015/06/fresh-from-the-farm.jpg', 'cooktime': '45 min', 'votes': '37', 'preptime': '30 min'}, {'image': 'https://cdn.shortpixel.ai/client/q_lossy,ret_img,w_480/https://www.soberjulie.com/wp-content/uploads/2015/06/fresh-from-the-farm.jpg', 'recipeinstructions': 'Preheat your oven to 300 degrees F and line an 8x8 baking pan with parchment paper. Be sure to bring the parchment up the sides as it makes it easier to lift out later.', 'totaltime': 'PT1H15M', 'name': 'Apple Crisp Shortbread Bars', 'cooktime': 'PT45M', 'ingredients': 'Shortbread Base:', 'recipeyield': '16', 'preptime': 'PT30M'}], 'hrecipe': [{'yield': '16', 'fn': 'Apple Crisp Shortbread Bars', 'photo': 'https://cdn.shortpixel.ai/client/to_avif,q_lossy,ret_img,w_480/https://www.soberjulie.com/wp-content/uploads/2015/06/fresh-from-the-farm.jpg'}], 'metatags': [{'og:image': 'https://www.soberjulie.com/wp-content/uploads/2015/09/Apple-Crisp-Shortbread-Bars-slider-300x154.png', 'og:type': 'article', 'article:published_time': '2015-09-21T16:38:45+00:00', 'og:image:width': '680', 'twitter:card': 'summary_large_image', 'og:site_name': 'Sober Julie', 'sitelock-site-verification': '5017', 'og:title': 'The BEST Apple Crisp Shortbread Bars Recipe - Sober Julie', 'og:image:height': '350', 'twitter:label1': 'Written by', 'twitter:label2': 'Est. reading time', 'og:description': ""This Apple Crisp Shortbread Bars Recipe is one you'll want to keep!! All of my shortbread loving friends will understand when they taste the apple.."", 'twitter:creator': '@SoberJulie', 'twitter:data1': 'SoberJulie', 'twitter:data2': '3 minutes', 'twitter:site': '@SoberJulie', 'article:modified_time': '2016-09-13T17:13:39+00:00', 'viewport': 'width=device-width, initial-scale=1', 'og:locale': 'en_US', 'og:url': 'https://www.soberjulie.com/2015/09/apple-crisp-shortbread-bars/'}], 'cse_image': [{'src': 'https://cdn.shortpixel.ai/client/q_lossy,ret_img,w_800,h_545/https://www.soberjulie.com/wp-content/uploads/2016/09/apple-pie-recipe-soberjulie.jpg'}]}",off,0.539251,1,"[{'src': 'https://encrypted-tbn3.gstatic.com/images?q=tbn:ANd9GcTBi2177CT70XHYMvj4qJNb_uySsfGDq61Z36c3chBJqAqA3UjFdIdkeFS1', 'width': '272', 'height': '185'}]",,"[{'ratingvalue': '4.8', 'ratingcount': '37'}]","[{'ratingstars': '5.0', 'image_url': 'https://cdn.shortpixel.ai/client/to_avif,q_lossy,ret_img,w_480/https://www.soberjulie.com/wp-content/uploads/2015/06/fresh-from-the-farm.jpg', 'cooktime': '45 min', 'votes': '37', 'preptime': '30 min'}, {'image': 'https://cdn.shortpixel.ai/client/q_lossy,ret_img,w_480/https://www.soberjulie.com/wp-content/uploads/2015/06/fresh-from-the-farm.jpg', 'recipeinstructions': 'Preheat your oven to 300 degrees F and line an 8x8 baking pan with parchment paper. Be sure to bring the parchment up the sides as it makes it easier to lift out later.', 'totaltime': 'PT1H15M', 'name': 'Apple Crisp Shortbread Bars', 'cooktime': 'PT45M', 'ingredients': 'Shortbread Base:', 'recipeyield': '16', 'preptime': 'PT30M'}]","[{'yield': '16', 'fn': 'Apple Crisp Shortbread Bars', 'photo': 'https://cdn.shortpixel.ai/client/to_avif,q_lossy,ret_img,w_480/https://www.soberjulie.com/wp-content/uploads/2015/06/fresh-from-the-farm.jpg'}]","[{'og:image': 'https://www.soberjulie.com/wp-content/uploads/2015/09/Apple-Crisp-Shortbread-Bars-slider-300x154.png', 'og:type': 'article', 'article:published_time': '2015-09-21T16:38:45+00:00', 'og:image:width': '680', 'twitter:card': 'summary_large_image', 'og:site_name': 'Sober Julie', 'sitelock-site-verification': '5017', 'og:title': 'The BEST Apple Crisp Shortbread Bars Recipe - Sober Julie', 'og:image:height': '350', 'twitter:label1': 'Written by', 'twitter:label2': 'Est. reading time', 'og:description': ""This Apple Crisp Shortbread Bars Recipe is one you'll want to keep!! All of my shortbread loving friends will understand when they taste the apple.."", 'twitter:creator': '@SoberJulie', 'twitter:data1': 'SoberJulie', 'twitter:data2': '3 minutes', 'twitter:site': '@SoberJulie', 'article:modified_time': '2016-09-13T17:13:39+00:00', 'viewport': 'width=device-width, initial-scale=1', 'og:locale': 'en_US', 'og:url': 'https://www.soberjulie.com/2015/09/apple-crisp-shortbread-bars/'}]",,"[{'src': 'https://cdn.shortpixel.ai/client/q_lossy,ret_img,w_800,h_545/https://www.soberjulie.com/wp-content/uploads/2016/09/apple-pie-recipe-soberjulie.jpg'}]",,,"[{'url_text': '21 Easy Fall Dessert Recipes For A Crowd & Make You Feel Cozy!', 'fn': '21 Easy Fall Dessert Recipes For A Crowd & Make You Feel Cozy!', 'url': 'https://www.crispyfoodidea.com/2020/07/easy-fall-dessert-recipe-for-a-crowd.html'}]",,,,https://www.soberjulie.com/wp-content/uploads/2015/09/Apple-Crisp-Shortbread-Bars-slider-300x154.png,article,,summary_large_image,Sober Julie,"width=device-width, initial-scale=1",,The BEST Apple Crisp Shortbread Bars Recipe - Sober Julie,https://www.soberjulie.com/2015/09/apple-crisp-shortbread-bars/,,This Apple Crisp Shortbread Bars Recipe is one you'll want to keep!! All of my shortbread loving friends will understand when they taste the apple..,,2015-09-21T16:38:45+00:00,680,5017,350,Written by,Est. reading time,@SoberJulie,SoberJulie,3 minutes,@SoberJulie,2016-09-13T17:13:39+00:00,en_US,,,,,,,,,,,,,,,,,,,,,,,,,
