12,11,us,Apple,13,Apple Pancake Recipe - Love and Lemons,"Apples, brown sugar, and cinnamon make up this custardy German-style apple 
pancake from my childhood.",www.loveandlemons.com,https://www.loveandlemons.com/apple-pancake/,2020-12-29 12:16:35.002646+00:00,10800000,tH0D1Eni7H8J,10,Holisticseo.digital,7b8760de16d1e86bc,0.54,"10,800,000",https://www.loveandlemons.com/apple-pancake/,https://www.loveandlemons.com/<b>apple</b>-pancake/,"<b>Apples</b>, brown sugar, and cinnamon make up this custardy German-style <b>apple</b> <br>
pancake from my childhood.",<b>Apple</b> Pancake Recipe - Love and Lemons,utf8,customsearch#result,utf8,"{'cse_thumbnail': [{'src': 'https://encrypted-tbn3.gstatic.com/images?q=tbn:ANd9GcQ9MIYQ3zzzNF2Z-vSboSsRO_P7TYeFAJnfT2Rmw0jw7W8DvLHzJqMrSbA', 'width': '210', 'height': '240'}], 'person': [{'name': 'Jeanine Donofrio'}], 'aggregaterating': [{'ratingvalue': '4.0', 'ratingcount': '4'}], 'recipe': [{'ratingstars': '4.0', 'image_url': 'https://cdn.loveandlemons.com/wp-content/uploads/2013/03/IMG_0026-2.jpg', 'votes': '4'}, {'image': 'https://cdn.loveandlemons.com/wp-content/uploads/2013/03/IMG_0026-2.jpg', 'recipeingredient': '2 tablespoons butter (or vegan earth balance)', 'recipeinstructions': 'Preheat oven to 375.', 'keywords': 'apple pancake, fall, spring, summer, winter', 'recipecategory': 'Breakfast, brunch', 'name': 'Apple Pancake', 'description': ""This heavenly apple pancake is perfect for a weekend brunch. Unlike a typical pancake, it has a rich, custardy texture that's delicious with powdered sugar on top."", 'recipeyield': '2-3'}], 'hrecipe': [{'summary': ""This heavenly apple pancake is perfect for a weekend brunch. Unlike a typical pancake, it has a rich, custardy texture that's delicious with powdered sugar on top."", 'author': 'Jeanine Donofrio', 'yield': '2-3', 'fn': 'Apple Pancake', 'photo': 'https://cdn.loveandlemons.com/wp-content/uploads/2013/03/IMG_0026-2.jpg'}], 'metatags': [{'og:image': 'https://cdn.loveandlemons.com/wp-content/uploads/2013/03/IMG_0026-2.jpg', 'article:published_time': '2013-03-04T16:58:30+00:00', 'og:image:width': '580', 'twitter:card': 'summary', 'og:site_name': 'Love and Lemons', 'msapplication-tileimage': '/ms-icon-144x144.png', 'og:description': 'Apples, brown sugar, and cinnamon make up this custardy German-style apple pancake from my childhood.', 'twitter:creator': '@lovelemonsfood', 'article:publisher': 'https://www.facebook.com/lovelemonsfood', 'og:image:secure_url': 'https://cdn.loveandlemons.com/wp-content/uploads/2013/03/IMG_0026-2.jpg', 'twitter:image': 'https://cdn.loveandlemons.com/wp-content/uploads/2013/03/IMG_0026-2.jpg', 'twitter:site': '@lovelemonsfood', 'article:modified_time': '2020-01-28T21:46:32+00:00', 'msapplication-tilecolor': '#ffffff', 'og:type': 'article', 'article:section': 'breakfast', 'twitter:title': 'Apple Pancake Recipe - Love and Lemons', 'og:title': 'Apple Pancake Recipe - Love and Lemons', 'og:image:height': '663', 'og:updated_time': '2020-01-28T21:46:32+00:00', 'article:tag': 'almond milk', 'viewport': 'width=device-width, initial-scale=1.0', 'twitter:description': 'Apples, brown sugar, and cinnamon make up this custardy German-style apple pancake from my childhood.', 'og:locale': 'en_US', 'og:url': 'https://www.loveandlemons.com/apple-pancake/'}], 'cse_image': [{'src': 'https://cdn.loveandlemons.com/wp-content/uploads/2013/03/IMG_0026-2.jpg'}]}",off,0.535399,11,"[{'src': 'https://encrypted-tbn3.gstatic.com/images?q=tbn:ANd9GcQ9MIYQ3zzzNF2Z-vSboSsRO_P7TYeFAJnfT2Rmw0jw7W8DvLHzJqMrSbA', 'width': '210', 'height': '240'}]",[{'name': 'Jeanine Donofrio'}],"[{'ratingvalue': '4.0', 'ratingcount': '4'}]","[{'ratingstars': '4.0', 'image_url': 'https://cdn.loveandlemons.com/wp-content/uploads/2013/03/IMG_0026-2.jpg', 'votes': '4'}, {'image': 'https://cdn.loveandlemons.com/wp-content/uploads/2013/03/IMG_0026-2.jpg', 'recipeingredient': '2 tablespoons butter (or vegan earth balance)', 'recipeinstructions': 'Preheat oven to 375.', 'keywords': 'apple pancake, fall, spring, summer, winter', 'recipecategory': 'Breakfast, brunch', 'name': 'Apple Pancake', 'description': ""This heavenly apple pancake is perfect for a weekend brunch. Unlike a typical pancake, it has a rich, custardy texture that's delicious with powdered sugar on top."", 'recipeyield': '2-3'}]","[{'summary': ""This heavenly apple pancake is perfect for a weekend brunch. Unlike a typical pancake, it has a rich, custardy texture that's delicious with powdered sugar on top."", 'author': 'Jeanine Donofrio', 'yield': '2-3', 'fn': 'Apple Pancake', 'photo': 'https://cdn.loveandlemons.com/wp-content/uploads/2013/03/IMG_0026-2.jpg'}]","[{'og:image': 'https://cdn.loveandlemons.com/wp-content/uploads/2013/03/IMG_0026-2.jpg', 'article:published_time': '2013-03-04T16:58:30+00:00', 'og:image:width': '580', 'twitter:card': 'summary', 'og:site_name': 'Love and Lemons', 'msapplication-tileimage': '/ms-icon-144x144.png', 'og:description': 'Apples, brown sugar, and cinnamon make up this custardy German-style apple pancake from my childhood.', 'twitter:creator': '@lovelemonsfood', 'article:publisher': 'https://www.facebook.com/lovelemonsfood', 'og:image:secure_url': 'https://cdn.loveandlemons.com/wp-content/uploads/2013/03/IMG_0026-2.jpg', 'twitter:image': 'https://cdn.loveandlemons.com/wp-content/uploads/2013/03/IMG_0026-2.jpg', 'twitter:site': '@lovelemonsfood', 'article:modified_time': '2020-01-28T21:46:32+00:00', 'msapplication-tilecolor': '#ffffff', 'og:type': 'article', 'article:section': 'breakfast', 'twitter:title': 'Apple Pancake Recipe - Love and Lemons', 'og:title': 'Apple Pancake Recipe - Love and Lemons', 'og:image:height': '663', 'og:updated_time': '2020-01-28T21:46:32+00:00', 'article:tag': 'almond milk', 'viewport': 'width=device-width, initial-scale=1.0', 'twitter:description': 'Apples, brown sugar, and cinnamon make up this custardy German-style apple pancake from my childhood.', 'og:locale': 'en_US', 'og:url': 'https://www.loveandlemons.com/apple-pancake/'}]",,[{'src': 'https://cdn.loveandlemons.com/wp-content/uploads/2013/03/IMG_0026-2.jpg'}],,,,,,,https://cdn.loveandlemons.com/wp-content/uploads/2013/03/IMG_0026-2.jpg,article,,summary,Love and Lemons,"width=device-width, initial-scale=1.0",,Apple Pancake Recipe - Love and Lemons,https://www.loveandlemons.com/apple-pancake/,,"Apples, brown sugar, and cinnamon make up this custardy German-style apple pancake from my childhood.",,2013-03-04T16:58:30+00:00,580,,663,,,@lovelemonsfood,,,@lovelemonsfood,2020-01-28T21:46:32+00:00,en_US,/ms-icon-144x144.png,https://cdn.loveandlemons.com/wp-content/uploads/2013/03/IMG_0026-2.jpg,,,Apple Pancake Recipe - Love and Lemons,"Apples, brown sugar, and cinnamon make up this custardy German-style apple pancake from my childhood.",,,https://www.facebook.com/lovelemonsfood,,2020-01-28T21:46:32+00:00,https://cdn.loveandlemons.com/wp-content/uploads/2013/03/IMG_0026-2.jpg,#ffffff,breakfast,almond milk,,,,,,,,,,
13,11,us,Apple,14,Apple-Habanero Margarita - Rick Bayless,"Combining apple brandy and roasted apple puree gives this drink a rich, roasty 
oaky flavor with hints of oakiness. A resonant reposado tequila fits in beautifully, ...",www.rickbayless.com,https://www.rickbayless.com/recipe/apple-habanero-margarita/,2020-12-29 12:16:35.002646+00:00,10800000,wZI0GpjVXCsJ,10,Holisticseo.digital,7b8760de16d1e86bc,0.54,"10,800,000",https://www.rickbayless.com/recipe/apple-habanero-margarita/,https://www.rickbayless.com/recipe/<b>apple</b>-habanero-margarita/,"Combining <b>apple</b> brandy and roasted <b>apple</b> puree gives this drink a rich, roasty <br>
oaky flavor with hints of oakiness. A resonant reposado tequila fits in beautifully,&nbsp;...",Apple-Habanero Margarita - Rick Bayless,utf8,customsearch#result,utf8,"{'hcard': [{'fn': 'AJ', 'nickname': 'AJ', 'photo': 'https://secure.gravatar.com/avatar/8613cd2b3b3af93cd16a87802a1d737d?s=74&d=mm&r=g'}, {'fn': 'Katy Lawrence', 'photo': 'https://secure.gravatar.com/avatar/?s=74&d=mm&r=g'}, {'fn': 'Kobi Nordwall', 'photo': 'https://secure.gravatar.com/avatar/35ee9211f32fea0e50cc11d1bf992470?s=74&d=mm&r=g'}, {'fn': 'Katy Lawrence', 'photo': 'https://secure.gravatar.com/avatar/?s=74&d=mm&r=g'}, {'fn': 'Marko', 'nickname': 'Marko', 'photo': 'https://secure.gravatar.com/avatar/0a5486f569dd93a45d0e026f7c520c50?s=74&d=mm&r=g'}, {'fn': 'Katy Lawrence', 'photo': 'https://secure.gravatar.com/avatar/?s=74&d=mm&r=g'}, {'fn': 'Leigh Mugford', 'photo': 'https://secure.gravatar.com/avatar/685deaedc06dc44100ece2d98c395eb4?s=74&d=mm&r=g'}], 'cse_thumbnail': [{'src': 'https://encrypted-tbn3.gstatic.com/images?q=tbn:ANd9GcTpQBcO_261zcvlGczs28KajFOIIDRs73wLUyXg9Owi95JW-BiNXBIe_V4', 'width': '275', 'height': '183'}], 'recipe': [{'image': 'https://www.rickbayless.com/wp-content/uploads/2014/10/yellowdrink_660X440_200_HORIZ.jpg', 'description': 'Habanero chiles, though foremost thought of in terms of their heat, are one of the most delicious chiles on earth—fruity, citrusy, wonderfully floral. And they pair perfectly with apples....', 'ingredients': 'Peppery Cinnamon Salt (see Bartender’s notes above) or coarse (kosher) salt', 'datepublished': '2014-10-24 13:20:19'}], 'metatags': [{'viewport': 'width=device-width, maximum-scale=1.0', 'msapplication-tileimage': 'https://www.rickbayless.com/wp-content/uploads/2020/07/cropped-favicon-1-270x270.png'}], 'cse_image': [{'src': 'https://www.rickbayless.com/wp-content/uploads/2014/10/yellowdrink_660X440_200_HORIZ.jpg'}]}",off,0.535399,11,"[{'src': 'https://encrypted-tbn3.gstatic.com/images?q=tbn:ANd9GcTpQBcO_261zcvlGczs28KajFOIIDRs73wLUyXg9Owi95JW-BiNXBIe_V4', 'width': '275', 'height': '183'}]",,,"[{'image': 'https://www.rickbayless.com/wp-content/uploads/2014/10/yellowdrink_660X440_200_HORIZ.jpg', 'description': 'Habanero chiles, though foremost thought of in terms of their heat, are one of the most delicious chiles on earth—fruity, citrusy, wonderfully floral. And they pair perfectly with apples....', 'ingredients': 'Peppery Cinnamon Salt (see Bartender’s notes above) or coarse (kosher) salt', 'datepublished': '2014-10-24 13:20:19'}]",,"[{'viewport': 'width=device-width, maximum-scale=1.0', 'msapplication-tileimage': 'https://www.rickbayless.com/wp-content/uploads/2020/07/cropped-favicon-1-270x270.png'}]",,[{'src': 'https://www.rickbayless.com/wp-content/uploads/2014/10/yellowdrink_660X440_200_HORIZ.jpg'}],,,"[{'fn': 'AJ', 'nickname': 'AJ', 'photo': 'https://secure.gravatar.com/avatar/8613cd2b3b3af93cd16a87802a1d737d?s=74&d=mm&r=g'}, {'fn': 'Katy Lawrence', 'photo': 'https://secure.gravatar.com/avatar/?s=74&d=mm&r=g'}, {'fn': 'Kobi Nordwall', 'photo': 'https://secure.gravatar.com/avatar/35ee9211f32fea0e50cc11d1bf992470?s=74&d=mm&r=g'}, {'fn': 'Katy Lawrence', 'photo': 'https://secure.gravatar.com/avatar/?s=74&d=mm&r=g'}, {'fn': 'Marko', 'nickname': 'Marko', 'photo': 'https://secure.gravatar.com/avatar/0a5486f569dd93a45d0e026f7c520c50?s=74&d=mm&r=g'}, {'fn': 'Katy Lawrence', 'photo': 'https://secure.gravatar.com/avatar/?s=74&d=mm&r=g'}, {'fn': 'Leigh Mugford', 'photo': 'https://secure.gravatar.com/avatar/685deaedc06dc44100ece2d98c395eb4?s=74&d=mm&r=g'}]",,,,,,,,,"width=device-width, maximum-scale=1.0",,,,,,,,,,,,,,,,,,,https://www.rickbayless.com/wp-content/uploads/2020/07/cropped-favicon-1-270x270.png,,,,,,,,,,,,,,,,,,,,,,,,
14,11,us,Apple,15,Mini Apple Cider Cakes. - Half Baked Harvest,"Oct 9, 2020 ... Made with boiled down spiced cider, apple butter, and cinnamon. Then baked 
and tossed with brown butter and spiced cinnamon sugar. There's ...",www.halfbakedharvest.com,https://www.halfbakedharvest.com/mini-apple-cider-cakes/,2020-12-29 12:16:35.002646+00:00,10800000,ILt4LcIwH0IJ,10,Holisticseo.digital,7b8760de16d1e86bc,0.54,"10,800,000",https://www.halfbakedharvest.com/mini-apple-cider-cakes/,https://www.halfbakedharvest.com/mini-<b>apple</b>-cider-cakes/,"Oct 9, 2020 <b>...</b> Made with boiled down spiced cider, <b>apple</b> butter, and cinnamon. Then baked <br>
and tossed with brown butter and spiced cinnamon sugar. There&#39;s&nbsp;...",Mini <b>Apple</b> Cider Cakes. - Half Baked Harvest,utf8,customsearch#result,utf8,"{'hcard': [{'fn': 'Christina', 'nickname': 'Christina', 'photo': 'https://secure.gravatar.com/avatar/74ff6c3ba9efe22b91eb99afa52d2022?s=60&d=mm&r=pg'}, {'url_text': 'halfbakedharvest', 'fn': 'halfbakedharvest', 'nickname': 'halfbakedharvest', 'photo': 'https://secure.gravatar.com/avatar/49ee4a23a1d5dffb1944da32800bb254?s=60&d=mm&r=pg', 'url': 'https://www.halfbakedharvest.com/'}, {'url_text': 'Ruth Miranda', 'fn': 'Ruth Miranda', 'photo': 'https://secure.gravatar.com/avatar/a203289cdb99d737b193428a11978e57?s=60&d=mm&r=pg', 'url': 'https://bloglairdutemps.blogspot.pt/'}, {'url_text': 'halfbakedharvest', 'fn': 'halfbakedharvest', 'nickname': 'halfbakedharvest', 'photo': 'https://secure.gravatar.com/avatar/49ee4a23a1d5dffb1944da32800bb254?s=60&d=mm&r=pg', 'url': 'https://www.halfbakedharvest.com/'}, {'fn': 'Sandra', 'nickname': 'Sandra', 'photo': 'https://secure.gravatar.com/avatar/b852f007499fa0ef070cabe02f64979c?s=60&d=mm&r=pg'}, {'url_text': 'halfbakedharvest', 'fn': 'halfbakedharvest', 'nickname': 'halfbakedharvest', 'photo': 'https://secure.gravatar.com/avatar/49ee4a23a1d5dffb1944da32800bb254?s=60&d=mm&r=pg', 'url': 'https://www.halfbakedharvest.com/'}, {'fn': 'Charlotte Moore', 'photo': 'https://secure.gravatar.com/avatar/7f842c59bc28603652ee5238298cc16f?s=60&d=mm&r=pg'}, {'url_text': 'halfbakedharvest', 'fn': 'halfbakedharvest', 'nickname': 'halfbakedharvest', 'photo': 'https://secure.gravatar.com/avatar/49ee4a23a1d5dffb1944da32800bb254?s=60&d=mm&r=pg', 'url': 'https://www.halfbakedharvest.com/'}, {'fn': 'Lori', 'nickname': 'Lori', 'photo': 'https://secure.gravatar.com/avatar/055c357b98bee5f07027433f1c923bf2?s=60&d=mm&r=pg'}, {'url_text': 'halfbakedharvest', 'fn': 'halfbakedharvest', 'nickname': 'halfbakedharvest', 'photo': 'https://secure.gravatar.com/avatar/49ee4a23a1d5dffb1944da32800bb254?s=60&d=mm&r=pg', 'url': 'https://www.halfbakedharvest.com/'}], 'cse_thumbnail': [{'src': 'https://encrypted-tbn3.gstatic.com/images?q=tbn:ANd9GcQRKxEVrovicuKUi-R_skBt3a6U2MWHPY7u0Yz6TWhHHtjEi6Y3seGiz24', 'width': '275', 'height': '183'}], 'recipe': [{'image_url': 'https://www.halfbakedharvest.com/wp-content/uploads/2020/10/Mini-Apple-Cider-Cakes-1.jpg', 'cooktime': '15 min', 'calories': '272 kcal', 'preptime': '20 min'}, {'image': 'https://www.halfbakedharvest.com/wp-content/uploads/2020/10/Mini-Apple-Cider-Cakes-1.jpg', 'recipeingredient': '1 1/2 cups apple cider', 'recipeinstructions': '1. Preheat oven to 350 degrees F. Grease 15-16 mini bundt pan or cupcake pan molds with butter.2. Bring the apple cider to a boil over high heat. Reduce the heat and simmer 10-15 minutes or...', 'totaltime': 'PT35M', 'author': 'halfbakedharvest', 'name': 'Mini Apple Cider Cakes', 'description': 'Best enjoyed warm, preferably with a mug of cocoa or a latte. The perfect way to celebrate the autumn apple season!', 'cooktime': 'PT15M', 'datepublished': '2020-10-09 02:00:39', 'preptime': 'PT20M', 'recipeyield': '15 cakes'}], 'hrecipe': [{'summary': 'Best enjoyed warm, preferably with a mug of cocoa or a latte. The perfect way to celebrate the autumn apple season!', 'author': 'halfbakedharvest', 'yield': '15 cakes', 'fn': 'Mini Apple Cider Cakes', 'photo': 'https://www.halfbakedharvest.com/wp-content/uploads/2020/10/Mini-Apple-Cider-Cakes-1.jpg', 'published': '2020-10-09', 'calories': '272 kcal'}], 'metatags': [{'msapplication-config': 'https://www.halfbakedharvest.com/wp-content/themes/LoveInspired/images/browserconfig.xml', 'og:image': 'https://www.halfbakedharvest.com/wp-content/uploads/2020/10/Mini-Apple-Cider-Cakes-1.jpg', 'theme-color': '#c6afa5', 'article:published_time': '2020-10-09T08:00:39+00:00', 'og:image:width': '1200', 'twitter:card': 'summary', 'og:site_name': 'Half Baked Harvest', 'twitter:label1': 'Written by', 'twitter:label2': 'Est. reading time', 'og:description': 'Made with Love', 'twitter:creator': '@hbharvest', 'article:publisher': 'https://www.facebook.com/hbharvest', 'twitter:data1': 'halfbakedharvest', 'twitter:image': 'https://www.halfbakedharvest.com/wp-content/uploads/2020/10/Mini-Apple-Cider-Cakes-1.jpg', 'twitter:data2': '6 minutes', 'twitter:site': '@hbharvest', 'article:modified_time': '2020-10-09T18:01:31+00:00', 'og:type': 'article', 'twitter:title': 'Mini Apple Cider Cakes.', 'og:title': 'Mini Apple Cider Cakes. - Half Baked Harvest', 'og:image:height': '1800', 'pinterest': 'nohover', 'og:updated_time': '2020-10-09T12:01:31+00:00', 'viewport': 'width=device-width, initial-scale=1', 'twitter:description': 'Mini Apple Cider Cakes...best enjoyed warm, preferably with a mug of cocoa or a latte. The perfect way to celebrate the autumn apple season!', 'og:locale': 'en_US', 'og:url': 'https://www.halfbakedharvest.com/mini-apple-cider-cakes/'}], 'cse_image': [{'src': 'https://www.halfbakedharvest.com/wp-content/uploads/2020/10/Mini-Apple-Cider-Cakes-12-700x467.jpg'}], 'blog': [{'logo': 'https://www.halfbakedharvest.com/wp-content/themes/LoveInspired/images/logo.png'}], 'nutritioninformation': [{'calories': '272 kcal'}]}",off,0.535399,11,"[{'src': 'https://encrypted-tbn3.gstatic.com/images?q=tbn:ANd9GcQRKxEVrovicuKUi-R_skBt3a6U2MWHPY7u0Yz6TWhHHtjEi6Y3seGiz24', 'width': '275', 'height': '183'}]",,,"[{'image_url': 'https://www.halfbakedharvest.com/wp-content/uploads/2020/10/Mini-Apple-Cider-Cakes-1.jpg', 'cooktime': '15 min', 'calories': '272 kcal', 'preptime': '20 min'}, {'image': 'https://www.halfbakedharvest.com/wp-content/uploads/2020/10/Mini-Apple-Cider-Cakes-1.jpg', 'recipeingredient': '1 1/2 cups apple cider', 'recipeinstructions': '1. Preheat oven to 350 degrees F. Grease 15-16 mini bundt pan or cupcake pan molds with butter.2. Bring the apple cider to a boil over high heat. Reduce the heat and simmer 10-15 minutes or...', 'totaltime': 'PT35M', 'author': 'halfbakedharvest', 'name': 'Mini Apple Cider Cakes', 'description': 'Best enjoyed warm, preferably with a mug of cocoa or a latte. The perfect way to celebrate the autumn apple season!', 'cooktime': 'PT15M', 'datepublished': '2020-10-09 02:00:39', 'preptime': 'PT20M', 'recipeyield': '15 cakes'}]","[{'summary': 'Best enjoyed warm, preferably with a mug of cocoa or a latte. The perfect way to celebrate the autumn apple season!', 'author': 'halfbakedharvest', 'yield': '15 cakes', 'fn': 'Mini Apple Cider Cakes', 'photo': 'https://www.halfbakedharvest.com/wp-content/uploads/2020/10/Mini-Apple-Cider-Cakes-1.jpg', 'published': '2020-10-09', 'calories': '272 kcal'}]","[{'msapplication-config': 'https://www.halfbakedharvest.com/wp-content/themes/LoveInspired/images/browserconfig.xml', 'og:image': 'https://www.halfbakedharvest.com/wp-content/uploads/2020/10/Mini-Apple-Cider-Cakes-1.jpg', 'theme-color': '#c6afa5', 'article:published_time': '2020-10-09T08:00:39+00:00', 'og:image:width': '1200', 'twitter:card': 'summary', 'og:site_name': 'Half Baked Harvest', 'twitter:label1': 'Written by', 'twitter:label2': 'Est. reading time', 'og:description': 'Made with Love', 'twitter:creator': '@hbharvest', 'article:publisher': 'https://www.facebook.com/hbharvest', 'twitter:data1': 'halfbakedharvest', 'twitter:image': 'https://www.halfbakedharvest.com/wp-content/uploads/2020/10/Mini-Apple-Cider-Cakes-1.jpg', 'twitter:data2': '6 minutes', 'twitter:site': '@hbharvest', 'article:modified_time': '2020-10-09T18:01:31+00:00', 'og:type': 'article', 'twitter:title': 'Mini Apple Cider Cakes.', 'og:title': 'Mini Apple Cider Cakes. - Half Baked Harvest', 'og:image:height': '1800', 'pinterest': 'nohover', 'og:updated_time': '2020-10-09T12:01:31+00:00', 'viewport': 'width=device-width, initial-scale=1', 'twitter:description': 'Mini Apple Cider Cakes...best enjoyed warm, preferably with a mug of cocoa or a latte. The perfect way to celebrate the autumn apple season!', 'og:locale': 'en_US', 'og:url': 'https://www.halfbakedharvest.com/mini-apple-cider-cakes/'}]",,[{'src': 'https://www.halfbakedharvest.com/wp-content/uploads/2020/10/Mini-Apple-Cider-Cakes-12-700x467.jpg'}],,[{'calories': '272 kcal'}],"[{'fn': 'Christina', 'nickname': 'Christina', 'photo': 'https://secure.gravatar.com/avatar/74ff6c3ba9efe22b91eb99afa52d2022?s=60&d=mm&r=pg'}, {'url_text': 'halfbakedharvest', 'fn': 'halfbakedharvest', 'nickname': 'halfbakedharvest', 'photo': 'https://secure.gravatar.com/avatar/49ee4a23a1d5dffb1944da32800bb254?s=60&d=mm&r=pg', 'url': 'https://www.halfbakedharvest.com/'}, {'url_text': 'Ruth Miranda', 'fn': 'Ruth Miranda', 'photo': 'https://secure.gravatar.com/avatar/a203289cdb99d737b193428a11978e57?s=60&d=mm&r=pg', 'url': 'https://bloglairdutemps.blogspot.pt/'}, {'url_text': 'halfbakedharvest', 'fn': 'halfbakedharvest', 'nickname': 'halfbakedharvest', 'photo': 'https://secure.gravatar.com/avatar/49ee4a23a1d5dffb1944da32800bb254?s=60&d=mm&r=pg', 'url': 'https://www.halfbakedharvest.com/'}, {'fn': 'Sandra', 'nickname': 'Sandra', 'photo': 'https://secure.gravatar.com/avatar/b852f007499fa0ef070cabe02f64979c?s=60&d=mm&r=pg'}, {'url_text': 'halfbakedharvest', 'fn': 'halfbakedharvest', 'nickname': 'halfbakedharvest', 'photo': 'https://secure.gravatar.com/avatar/49ee4a23a1d5dffb1944da32800bb254?s=60&d=mm&r=pg', 'url': 'https://www.halfbakedharvest.com/'}, {'fn': 'Charlotte Moore', 'photo': 'https://secure.gravatar.com/avatar/7f842c59bc28603652ee5238298cc16f?s=60&d=mm&r=pg'}, {'url_text': 'halfbakedharvest', 'fn': 'halfbakedharvest', 'nickname': 'halfbakedharvest', 'photo': 'https://secure.gravatar.com/avatar/49ee4a23a1d5dffb1944da32800bb254?s=60&d=mm&r=pg', 'url': 'https://www.halfbakedharvest.com/'}, {'fn': 'Lori', 'nickname': 'Lori', 'photo': 'https://secure.gravatar.com/avatar/055c357b98bee5f07027433f1c923bf2?s=60&d=mm&r=pg'}, {'url_text': 'halfbakedharvest', 'fn': 'halfbakedharvest', 'nickname': 'halfbakedharvest', 'photo': 'https://secure.gravatar.com/avatar/49ee4a23a1d5dffb1944da32800bb254?s=60&d=mm&r=pg', 'url': 'https://www.halfbakedharvest.com/'}]",[{'logo': 'https://www.halfbakedharvest.com/wp-content/themes/LoveInspired/images/logo.png'}],,,https://www.halfbakedharvest.com/wp-content/uploads/2020/10/Mini-Apple-Cider-Cakes-1.jpg,article,,summary,Half Baked Harvest,"width=device-width, initial-scale=1",,Mini Apple Cider Cakes. - Half Baked Harvest,https://www.halfbakedharvest.com/mini-apple-cider-cakes/,,Made with Love,,2020-10-09T08:00:39+00:00,1200,,1800,Written by,Est. reading time,@hbharvest,halfbakedharvest,6 minutes,@hbharvest,2020-10-09T18:01:31+00:00,en_US,,https://www.halfbakedharvest.com/wp-content/uploads/2020/10/Mini-Apple-Cider-Cakes-1.jpg,,,Mini Apple Cider Cakes.,"Mini Apple Cider Cakes...best enjoyed warm, preferably with a mug of cocoa or a latte. The perfect way to celebrate the autumn apple season!",https://www.halfbakedharvest.com/wp-content/themes/LoveInspired/images/browserconfig.xml,#c6afa5,https://www.facebook.com/hbharvest,nohover,2020-10-09T12:01:31+00:00,,,,,,,,,,,,,,
