,start,gl,searchTerms,rank,title,snippet,displayLink,link,queryTime,totalResults,cacheId,count,cseName,cx,formattedSearchTime,formattedTotalResults,formattedUrl,htmlFormattedUrl,htmlSnippet,htmlTitle,inputEncoding,kind,outputEncoding,pagemap,safe,searchTime,startIndex,city,person,metatags,blogposting,cse_thumbnail,cse_image,geocoordinates,offer,aggregateoffer,organization,postaladdress,parkingfacility,place,state,localbusiness,listitem,plumber,contactpoint,breadcrumb,legalservice,content,country,thing,sitenavigationelement,singlefamilyresidence,searchaction,aggregaterating,rating,review,service,hreviewaggregate,hatomfeed,geocircle,autodealer,website,viewport,author,msapplication-tilecolor,og:image,place:location:longitude,og:type,theme-color,place:location:latitude,og:title,msapplication-tileimage,og:description,referrer,fb:app_id,og:url,twitter:app:url:iphone,twitter:app:id:googleplay,twitter:card,og:site_name,twitter:app:url:ipad,apple-mobile-web-app-title,al:android:package,twitter:app:id:iphone,al:ios:url,twitter:creator,al:ios:app_store_id,twitter:site,handheldfriendly,al:ios:app_name,msvalidate.01,al:web:url,al:android:url,twitter:app:url:googleplay,apple-mobile-web-app-status-bar-style,twitter:app:name:ipad,apple-mobile-web-app-capable,mobileoptimized,mobile-web-app-capable,al:android:app_name,format-detection,p:domain_verify,twitter:image,article:publisher,apple-itunes-app,navi-cs-enabled,gam-object-prefix,context_keys,default-location-id,csrf-param,page-template-name,gam-adunit-prefix,csrf-token,location,ad-environment,navi-debug,navi-host,msapplication-config,twitter:title,twitter:url,business:contact_data:country_name,twitter:description,og:image:width,og:image:height,article:modified_time,og:locale,og:image:url,og:image:type,twitter:label1,twitter:label2,twitter:data1,twitter:data2,metatag_rating,yandex-verification,distribution
0,1,us,Apple,1,Starting at Apple - Mike Bland,"Nov 6, 2018 ... In a bizarre twist of fate, after a great run at Cvent, I've taken the unexpected 
opportunity to join Apple.",mike-bland.com,https://mike-bland.com/2018/11/06/starting-at-apple.html,2020-12-29 12:17:13.609162+00:00,692000,Lz0knt5hnhMJ,10,Holisticseo.digital,7b8760de16d1e86bc,0.52,"692,000",https://mike-bland.com/2018/11/06/starting-at-apple.html,https://mike-bland.com/2018/11/06/starting-at-<b>apple</b>.html,"Nov 6, 2018 <b>...</b> In a bizarre twist of fate, after a great run at Cvent, I&#39;ve taken the unexpected <br>
opportunity to join <b>Apple</b>.",Starting at <b>Apple</b> - Mike Bland,utf8,customsearch#result,utf8,"{'city': [{'name': 'Cupertino'}], 'person': [{'name': 'Mike Bland', 'url': 'Mike Bland'}], 'metatags': [{'viewport': 'width=device-width, initial-scale=1', 'author': 'Mike Bland'}], 'blogposting': [{'articlebody': 'Wednesday, October 31, 2018 was my last day at Cvent. Monday, November 5, 2018 was my first day at Apple. I’ve written so little in over a year, and there’s so much to say and tell. I’ve...', 'keywords': 'Apple, Cvent, grouplets, personal', 'copyrightyear': '2018', 'name': 'Starting at Apple - Mike Bland', 'description': ""In a bizarre twist of fate, after a great run at Cvent, I've taken the unexpected opportunity to join Apple."", 'url': 'https://mike-bland.com/2018/11/06/starting-at-apple.html', 'datepublished': '06 Nov 2018'}]}",off,0.515537,1,[{'name': 'Cupertino'}],"[{'name': 'Mike Bland', 'url': 'Mike Bland'}]","[{'viewport': 'width=device-width, initial-scale=1', 'author': 'Mike Bland'}]","[{'articlebody': 'Wednesday, October 31, 2018 was my last day at Cvent. Monday, November 5, 2018 was my first day at Apple. I’ve written so little in over a year, and there’s so much to say and tell. I’ve...', 'keywords': 'Apple, Cvent, grouplets, personal', 'copyrightyear': '2018', 'name': 'Starting at Apple - Mike Bland', 'description': ""In a bizarre twist of fate, after a great run at Cvent, I've taken the unexpected opportunity to join Apple."", 'url': 'https://mike-bland.com/2018/11/06/starting-at-apple.html', 'datepublished': '06 Nov 2018'}]",,,,,,,,,,,,,,,,,,,,,,,,,,,,,,,,"width=device-width, initial-scale=1",Mike Bland,,,,,,,,,,,,,,,,,,,,,,,,,,,,,,,,,,,,,,,,,,,,,,,,,,,,,,,,,,,,,,,,,,,,,,,
1,1,us,Apple,2,"Apple Creek, OH - Apple Creek, Ohio Map & Directions - MapQuest","Get directions, maps, and traffic for Apple Creek, OH. Check flight prices and 
hotel availability for your visit.",www.mapquest.com,https://www.mapquest.com/us/ohio/apple-creek-oh-282042052,2020-12-29 12:17:13.609162+00:00,692000,b066d14fO4EJ,10,Holisticseo.digital,7b8760de16d1e86bc,0.52,"692,000",https://www.mapquest.com/us/ohio/apple-creek-oh-282042052,https://www.mapquest.com/us/ohio/<b>apple</b>-creek-oh-282042052,"Get directions, maps, and traffic for <b>Apple</b> Creek, OH. Check flight prices and <br>
hotel availability for your visit.","<b>Apple</b> Creek, OH - <b>Apple</b> Creek, Ohio Map &amp; Directions - MapQuest",utf8,customsearch#result,utf8,"{'cse_thumbnail': [{'src': 'https://encrypted-tbn0.gstatic.com/images?q=tbn:ANd9GcRToKsTUc9oHKlAxC860jQmmNYBjGdRw9DHcyM9TFXb371LAo3giR7VPaP9', 'width': '225', 'height': '225'}], 'city': [{'description': 'Description Apple Creek is a village in Wayne County, Ohio, United States. The population was 999 at the 2000 census. Apple Creek is located at 40°45′2″N 81°50′13″W / 40.75056°N...'}], 'metatags': [{'msapplication-tilecolor': '#000000', 'og:image': 'https://static.mqcdn.com/yogi-efs/opengraph-preview-default-400x400.png', 'place:location:longitude': '-81.835013', 'og:type': 'place', 'theme-color': '#ffffff', 'place:location:latitude': '40.748291', 'og:title': 'Apple Creek, OH - Apple Creek, Ohio Map & Directions - MapQuest', 'msapplication-tileimage': '/mstile-144x144.png', 'og:description': 'Get directions, maps, and traffic for Apple Creek, OH. Check flight prices and hotel availability for your visit.', 'referrer': 'origin', 'fb:app_id': '280364548642386', 'viewport': 'width=device-width, initial-scale=1.0, maximum-scale=1.0, user-scalable=no', 'og:url': 'http://www.mapquest.com/us/ohio/apple-creek-oh-282042052'}], 'cse_image': [{'src': 'https://static.mqcdn.com/yogi-efs/opengraph-preview-default-400x400.png'}], 'geocoordinates': [{'latitude': '40.748291', 'longitude': '-81.835013'}]}",off,0.515537,1,"[{'description': 'Description Apple Creek is a village in Wayne County, Ohio, United States. The population was 999 at the 2000 census. Apple Creek is located at 40°45′2″N 81°50′13″W / 40.75056°N...'}]",,"[{'msapplication-tilecolor': '#000000', 'og:image': 'https://static.mqcdn.com/yogi-efs/opengraph-preview-default-400x400.png', 'place:location:longitude': '-81.835013', 'og:type': 'place', 'theme-color': '#ffffff', 'place:location:latitude': '40.748291', 'og:title': 'Apple Creek, OH - Apple Creek, Ohio Map & Directions - MapQuest', 'msapplication-tileimage': '/mstile-144x144.png', 'og:description': 'Get directions, maps, and traffic for Apple Creek, OH. Check flight prices and hotel availability for your visit.', 'referrer': 'origin', 'fb:app_id': '280364548642386', 'viewport': 'width=device-width, initial-scale=1.0, maximum-scale=1.0, user-scalable=no', 'og:url': 'http://www.mapquest.com/us/ohio/apple-creek-oh-282042052'}]",,"[{'src': 'https://encrypted-tbn0.gstatic.com/images?q=tbn:ANd9GcRToKsTUc9oHKlAxC860jQmmNYBjGdRw9DHcyM9TFXb371LAo3giR7VPaP9', 'width': '225', 'height': '225'}]",[{'src': 'https://static.mqcdn.com/yogi-efs/opengraph-preview-default-400x400.png'}],"[{'latitude': '40.748291', 'longitude': '-81.835013'}]",,,,,,,,,,,,,,,,,,,,,,,,,,,,,"width=device-width, initial-scale=1.0, maximum-scale=1.0, user-scalable=no",,#000000,https://static.mqcdn.com/yogi-efs/opengraph-preview-default-400x400.png,-81.835013,place,#ffffff,40.748291,"Apple Creek, OH - Apple Creek, Ohio Map & Directions - MapQuest",/mstile-144x144.png,"Get directions, maps, and traffic for Apple Creek, OH. Check flight prices and hotel availability for your visit.",origin,280364548642386,http://www.mapquest.com/us/ohio/apple-creek-oh-282042052,,,,,,,,,,,,,,,,,,,,,,,,,,,,,,,,,,,,,,,,,,,,,,,,,,,,,,,,,,,
